id,Tiêu đề,Giá,Khoảng giá min,Khoảng giá max,Địa chỉ,Mô tả chi tiết,Thương hiệu,Dòng xe,Năm đăng ký,Số Km đã đi,Tình trạng,Loại xe,Dung tích xe,Xuất xứ,Chính sách bảo hành,Trọng lượng,Href,Thời gian ghi nhận,Gia_Thuc_Te_Trieu,Gia_AI_Du_Doan_Trieu,Co_Bat_Thuong,Ly_Do_Chi_Tiet
12,SH Ý Zin,100.000.000 đ,23.67 tr,27.79 tr,"Phường Phạm Ngũ Lão, Quận 1, Tp Hồ Chí Minh","Ai có nhu cầu mua xe liên hệ sdt.
Xem xe trực tiếp quận 1,hcm",Honda,SH,2005,8000,Đã sử dụng,Tay ga,100 - 175 cc,Nước khác,Bảo hành hãng,> 50 kg,https://xe.chotot.com/mua-ban-xe-may-quan-1-tp-ho-chi-minh/124960442.htm,2025-11-28 15:50:25,100.0,54.223774,1,Giá CAO bất thường. AI dự đoán: 54.22 tr. (Cao hơn 84%)
24,Do đổi xe cần sang xe,15.000.000 đ,7.94 tr,9.32 tr,"Phường Nguyễn Cư Trinh, Quận 1, Tp Hồ Chí Minh",Bán xe wave RSX fi 2014 cần bán giữ kỹ chạy ít cho ai có nhu cầu cần thiết sử dụng nhanh gọn bớt chút lộc cho ai tới sớm,Honda,Wave,2014,6000,Đã sử dụng,Xe số,100 - 175 cc,Việt Nam,Bảo hành hãng,> 50 kg,https://xe.chotot.com/mua-ban-xe-may-quan-1-tp-ho-chi-minh/124718551.htm,2025-11-28 15:50:25,15.0,7.5410633,1,Giá CAO bất thường. AI dự đoán: 7.54 tr. (Cao hơn 99%)
26,Không có nhu cầu chạy xe nhượng lại cho anh em cân,350.000.000 đ,322 tr,378 tr,"Phường Bến Nghé, Quận 1, Tp Hồ Chí Minh","Xe Ít đi, anh em xem xe thì nhắn tin cho tôi trước.
Xem xe ở Vinhomes Central Park (Bình Thạnh, HCM)",KTM,1290 Super Duke R,2014,13000,Đã sử dụng,Tay côn/Moto,Trên 175 cc,Nước khác,Bảo hành hãng,> 50 kg,https://xe.chotot.com/mua-ban-xe-may-quan-1-tp-ho-chi-minh/124493960.htm,2025-11-28 15:50:25,350.0,21.039324,1,Giá CAO bất thường. AI dự đoán: 21.04 tr. (Cao hơn 1564%)
36,"Cần bán xe Sh 150i VN, thắng cbs màu đen nhám",70.000.000 đ,65.71 tr,77.13 tr,"Phường Cầu Ông Lãnh, Quận 1, Tp Hồ Chí Minh","Xe nhà đi kỹ, có trầy theo năm tháng. Xe chính chủ ( ko phải cửa hàng mua bán hay trung gian)
Mẫu 2019, đăng ký t1.2020, chiếc cuối cùng ở Sg, xe màu đen nhám. Máy móc chưa bung. Xe vừa thay ngớt, dây coro, bình, nước mát.
Xem xe tại quận 7.
Ko bán cho Ac cửa hàng hay mô giới. Xe chính chủ đăng ký .",Honda,SH,2020,52000,Đã sử dụng,Tay ga,100 - 175 cc,Nhật Bản,Bảo hành hãng,> 50 kg,https://xe.chotot.com/mua-ban-xe-may-quan-1-tp-ho-chi-minh/124102728.htm,2025-11-28 15:50:25,70.0,38.403263,1,Giá CAO bất thường. AI dự đoán: 38.40 tr. (Cao hơn 82%)
39,CHÍNH CHỦ BÁN XE CHÍNH HANG XE PHÁP,49.000.000 đ,33.12 tr,38.88 tr,"Phường Tân Định, Quận 1, Tp Hồ Chí Minh","- Hãng xe Pháp nổi tiếng hình Sư tử (PeuGeot)
- Xe đăng ký năm 2021 (2022 và 2023 dính Covid nên xe chạy rất ít) và Nữ chạy cẩn thânh nên còn rất mới, máy móc zin
- Thời gian sử dụng thực tế chưa tới 2 năm
- Giấy tờ Chính Chủ",Peugeot,Django,2021,1363,Đã sử dụng,Tay ga,50 - 100 cc,Nước khác,Bảo hành hãng,> 50 kg,https://xe.chotot.com/mua-ban-xe-may-quan-1-tp-ho-chi-minh/122246811.htm,2025-11-28 15:50:25,49.0,22.626429,1,Giá CAO bất thường. AI dự đoán: 22.63 tr. (Cao hơn 117%)
40,Click Thái 125 Trắng 2015,64.999.999 đ,43.42 tr,50.97 tr,"Phường Nguyễn Cư Trinh, Quận 1, Tp Hồ Chí Minh","Xe gốc Phú Nhuận, chủ chạy kỹ, ngoại hình đẹp tưng, máy móc chưa chỉnh sửa.
ODO 25k km, ko tua.
Máy móc, phanh nhớt đã được kiểm tra, vệ sinh, bảo dưỡng.

Bao công chứng, giấy tờ hợp lệ
—-
Liên hệ: a Nhựt (Nguyễn Cư Trinh)
SDT: ***",Honda,Click,2015,25000,Đã sử dụng,Xe số,100 - 175 cc,Thái Lan,Bảo hành hãng,> 50 kg,https://xe.chotot.com/mua-ban-xe-may-quan-1-tp-ho-chi-minh/123981168.htm,2025-11-28 15:50:25,64.999999,24.931479,1,Giá CAO bất thường. AI dự đoán: 24.93 tr. (Cao hơn 161%)
45,Airblade 2020 62+2,45.000.000 đ,29.93 tr,35.13 tr,"Phường Đa Kao, Quận 1, Tp Hồ Chí Minh","Airblade 150 2020 62+2 cần bán :

Full máy 62+2 :

Dên lightspeed

Lòng redleo 62

Full Aracer Mini 5 + Af2 Sensor 4.9 Autotune cực nhạy

Pô zin móc

Lọc gió DNA

Nồi canh theo bài

Đầu zin làm lên

Cam BRT

Họng Gió BRT

Co gió Intake

Kim phun BRT

Pô arka g310

Mâm rcb sơn màu vàng cát

Bộ mạch tăng sáng, demi đổi màu, auto passing chỉnh trên app đt

Yên xe tấn tài

Cặp vỏ michelin gp mới thay

Máy móc hoạt động hoàn hảo do mới bảo trì

Bs tp dễ nhìn


Dá ra đi 4x , x có như không nếu nhiệt tình

Xe công chứng 1 nốt nhạc do ngay chủ đầu tiên

Ae có nhu cầu xin liên hệ",Honda,Air Blade,2020,80000,Đã sử dụng,Tay ga,100 - 175 cc,Việt Nam,Bảo hành hãng,> 50 kg,https://xe.chotot.com/mua-ban-xe-may-quan-1-tp-ho-chi-minh/123810022.htm,2025-11-28 15:50:25,45.0,25.61001,1,Giá CAO bất thường. AI dự đoán: 25.61 tr. (Cao hơn 76%)
62,Bán xe Honda Rebel 250cc năm 1986,106.000.000 đ,,,"Phường Tân Định, Quận 1, Tp Hồ Chí Minh","Bán xe Honda Rebel 250cc năm 1986

Xe nhà đang đi giờ em muốn đổi xe khác nên bán lại cho anh em nào yêu thích dòng xe này.

- Dung tích: 250cc
- Năm sản xuất: 1986
- Đồ zin: 95%
- Tình trạng: Hoàn hảo, nguyên bản, xe đẹp

Giấy tờ
- Hải quan chính ngạch
- Xe chính chủ, mua bán sang tên ngay luôn.
- Biển số TP HCM

Tình trạng xe
- Xe đang chạy ngon lành, mượt mà
- Bảo dưỡng định kỳ
- Không cần sửa chữa, mua về chỉ đổ xăng vào chạy
- Xe kiểu dáng huyền thoại, phong cách cổ điển
- Động cơ mạnh mẽ, bền bỉ
- Phù hợp cho những ai yêu thích dòng xe mô tô cổ

Giá bán: 106 triệu

Anh em thiện chí mua liên hệ trực tiếp với em là chính chủ, xem xe tại Quận 1.
Cảm ơn Chợ Tốt đã đăng tin!",Honda,Rebel,1986,50000,Đã sử dụng,Tay côn/Moto,Trên 175 cc,Đang cập nhật,Bảo hành hãng,> 50 kg,https://xe.chotot.com/mua-ban-xe-may-quan-1-tp-ho-chi-minh/121008418.htm,2025-11-28 15:50:25,106.0,52.000122,1,Giá CAO bất thường. AI dự đoán: 52.00 tr. (Cao hơn 104%)
64,cần bán,370 đ,361.56 tr,424.44 tr,"Phường Bến Nghé, Quận 1, Tp Hồ Chí Minh","𝐓𝐫𝐢𝐮𝐦𝐩𝐡 Bonneville 𝐓𝟗𝟎𝟎 MY2024
Màu Jet Black siêu đẹp
- Đăng ký lần đầu 2/2024 một chủ, tôi chủ từ đầu. Biển số TP thuế sang tên 1%
- Odo lướt: 8900km xe đi kĩ, chưa một lần đổ ngã. Xe có gắn thêm chống đổ, che két nước, bv gầm…
- Giá em bán: 3xx triệu, cam kết xe không đâm đụng, không ngập nước, ngã…
☎️ 𝑯𝒐𝒕𝒍𝒊𝒏𝒆: ***",Triumph,Triumph Bonneville T100,2024,8900,Đã sử dụng,Tay côn/Moto,Trên 175 cc,Nước khác,Bảo hành hãng,> 50 kg,https://xe.chotot.com/mua-ban-xe-may-quan-1-tp-ho-chi-minh/123668716.htm,2025-11-28 15:50:25,0.00037,7.0273867,1,Giá RẺ bất thường. AI dự đoán: 7.03 tr. (Thấp hơn 100%)
67,dư dùng nên bán,1 đ,30.13 tr,35.37 tr,"Phường Nguyễn Cư Trinh, Quận 1, Tp Hồ Chí Minh","Xe 2019 , 9c bstp sang tên uỷ quyền vô tư . Xe có vô một số đồ chơi . Xe nhà chạy kĩ , dàn ngoài có trày ít theo năm tháng . Mua về chỉ đổ xăng vô chạy . Xe chưa rớt đầu . Giá 3x trung , có thương lượng",Honda,Vario,2019,81000,Đã sử dụng,Tay ga,100 - 175 cc,Nước khác,Bảo hành hãng,> 50 kg,https://xe.chotot.com/mua-ban-xe-may-quan-1-tp-ho-chi-minh/123663692.htm,2025-11-28 15:50:25,1e-06,23.11755,1,Giá RẺ bất thường. AI dự đoán: 23.12 tr. (Thấp hơn 100%)
89,54zz máy nhão gtdd,4.000.000 đ,28.55 tr,33.51 tr,"Phường Nguyễn Cư Trinh, Quận 1, Tp Hồ Chí Minh","Máy 54zz máy kêu
Bán hoặc giao lưu mio hoặc luvias",Yamaha,Exciter,2023,40000,Đã sử dụng,Tay côn/Moto,100 - 175 cc,Việt Nam,Bảo hành hãng,> 50 kg,https://xe.chotot.com/mua-ban-xe-may-quan-1-tp-ho-chi-minh/123476920.htm,2025-11-28 15:50:25,4.0,25.240824,1,Giá RẺ bất thường. AI dự đoán: 25.24 tr. (Thấp hơn 84%)
95,Bán cho ae dam mê xe xipo,15.000.000 đ,118.87 tr,139.54 tr,"Phường Bến Nghé, Quận 1, Tp Hồ Chí Minh",Xe đẹp như hình máy bao ngon bao êm mua về chỉ chạy ko nhận tin nhấn mua gọi đt hoặc zalo nhé ok ***,Suzuki,Sport / Xipo,1998,15000,Đã sử dụng,Tay côn/Moto,100 - 175 cc,Đang cập nhật,Bảo hành hãng,> 50 kg,https://xe.chotot.com/mua-ban-xe-may-quan-1-tp-ho-chi-minh/123422941.htm,2025-11-28 15:50:25,15.0,72.39694,1,Giá RẺ bất thường. AI dự đoán: 72.40 tr. (Thấp hơn 79%)
101,Bán cho ai có nhu cầu,11.100.000 đ,3.91 tr,4.59 tr,"Phường Tân Định, Quận 1, Tp Hồ Chí Minh","Xe chính chủ
Giá còn thương lượng
32/16 nguyễn hữu cầu",Hãng khác,Dòng khác,2001,50000,Đã sử dụng,Xe số,100 - 175 cc,Việt Nam,Bảo hành hãng,> 50 kg,https://xe.chotot.com/mua-ban-xe-may-quan-1-tp-ho-chi-minh/123372901.htm,2025-11-28 15:50:25,11.1,5.632606,1,Giá CAO bất thường. AI dự đoán: 5.63 tr. (Cao hơn 97%)
109,còn thương lượng,12.000.000 đ,3.91 tr,4.59 tr,"Phường Tân Định, Quận 1, Tp Hồ Chí Minh","Cần bán gấp xe như mới
Liên hệ nhanh với e nha",Hãng khác,Dòng khác,2001,150000,Đã sử dụng,Xe số,100 - 175 cc,Việt Nam,Bảo hành hãng,> 50 kg,https://xe.chotot.com/mua-ban-xe-may-quan-1-tp-ho-chi-minh/123317552.htm,2025-11-28 15:50:25,12.0,5.9378295,1,Giá CAO bất thường. AI dự đoán: 5.94 tr. (Cao hơn 102%)
141,Wave alpha 2002 bstp chính chủ,14.500.000 đ,10.55 tr,12.38 tr,"Phường Võ Thị Sáu, Quận 3, Tp Hồ Chí Minh","Do không còn nhu cầu sử dụng nên bán em nó,xe nhà đang đi máy móc ổn định,xe đã làm nồi,đầu lòng vì xe dùng để đi nên máy móc xuống thì phải làm đi cho mạnh,máy móc làm theo zin chứ không độ.máy giữa chưa chẻ.xe chính mình đứng tên.ưu tiên bán cho người sử dụng,cò lái giá này mấy anh không lấy được đâu,xin cám ơn.",Honda,Wave,2002,100000,Đã sử dụng,Xe số,50 - 100 cc,Việt Nam,Bảo hành hãng,> 50 kg,https://xe.chotot.com/mua-ban-xe-may-quan-3-tp-ho-chi-minh/124506323.htm,2025-11-28 15:50:25,14.5,7.3135405,1,Giá CAO bất thường. AI dự đoán: 7.31 tr. (Cao hơn 98%)
155,Xe Honda Spacy 2001 xuất xứ Nhựt,85.000.000 đ,23.12 tr,27.14 tr,"Phường 10, Quận 3, Tp Hồ Chí Minh","Xe Honda Spacy đăng ký đời 2001
Xuất xứ: Nhựt
Màu nho",Honda,Spacy,2001,85000,Đã sử dụng,Tay ga,100 - 175 cc,Nhật Bản,Bảo hành hãng,> 50 kg,https://xe.chotot.com/mua-ban-xe-may-quan-3-tp-ho-chi-minh/122655890.htm,2025-11-28 15:50:25,85.0,31.313015,1,Giá CAO bất thường. AI dự đoán: 31.31 tr. (Cao hơn 171%)
161,ban xe,80.000.000 đ,62.76 tr,73.68 tr,"Phường 1, Quận 3, Tp Hồ Chí Minh",Xe còn đẹp. Chính chủ. Ko đâm đụng. Xem xe tại nhà,Honda,SH,2019,50000,Đã sử dụng,Tay ga,100 - 175 cc,Việt Nam,Bảo hành hãng,> 50 kg,https://xe.chotot.com/mua-ban-xe-may-quan-3-tp-ho-chi-minh/124395562.htm,2025-11-28 15:50:25,80.0,42.400536,1,Giá CAO bất thường. AI dự đoán: 42.40 tr. (Cao hơn 89%)
162,"XE NHÀ DÙNG, FUTURE BỀN ĐẸP VỚI THỜI GIAN",35.000.000 đ,14.16 tr,16.63 tr,"Phường 4, Quận 3, Tp Hồ Chí Minh","-Xe 1 đời chủ, bao sang tên
-Máy đề là nổ, bao tiết kiệm xăng
-Xe mới keng, anh em mua sưu tầm liên hệ.
-Xe ở Q3",Honda,Future,2000,12000,Đã sử dụng,Xe số,100 - 175 cc,Thái Lan,Bảo hành hãng,> 50 kg,https://xe.chotot.com/mua-ban-xe-may-quan-3-tp-ho-chi-minh/124330476.htm,2025-11-28 15:50:25,35.0,15.656689,1,Giá CAO bất thường. AI dự đoán: 15.66 tr. (Cao hơn 124%)
163,BÁN XE CÒN NGUYEN BẢN,80.000.000 đ,35.74 tr,41.95 tr,"Phường Võ Thị Sáu, Quận 3, Tp Hồ Chí Minh","Gia đình xe muốn bán HONDA đời 82 . Xe đi ít nên rất đẹp, máy móc zin đi êm, sơn nhựa đẹp còn ZIN chắc chắn. Giấy tờ đầy đủ, xem xe trực tiếp tại nhà.
Ac quan tâm alo nhé!
 ĐT: *** anh Quang",Honda,Dòng khác,1998,70000,Đã sử dụng,Xe số,50 - 100 cc,Nhật Bản,Bảo hành hãng,> 50 kg,https://xe.chotot.com/mua-ban-xe-may-quan-3-tp-ho-chi-minh/124059561.htm,2025-11-28 15:50:25,80.0,19.11937,1,Giá CAO bất thường. AI dự đoán: 19.12 tr. (Cao hơn 318%)
171,Cần bán sh 150 ý đầu 105,12.345.678 đ,98.4 tr,115.51 tr,"Phường 11, Quận 3, Tp Hồ Chí Minh","Cần bán sh 150 ý đầu máy 105. Bs tphcm . Đăng ký 2010 chính chủ ký giấy mua bán hay ủy quyền tùy ae 
Tình trạng máy móc nguyên zin đầu chao chưa chạm, dàn áo mới sơn lại đỏ tươi 
Giá: 133tr có giá fixx đẹp cho ae xem e trực tiếp nhanh gọn",Honda,SH,2010,50000,Đã sử dụng,Tay ga,100 - 175 cc,Nước khác,Bảo hành hãng,> 50 kg,https://xe.chotot.com/mua-ban-xe-may-quan-3-tp-ho-chi-minh/123914282.htm,2025-11-28 15:50:25,12.345678,101.42339,1,Giá RẺ bất thường. AI dự đoán: 101.42 tr. (Thấp hơn 88%)
192,Xe honda 3 bánh,24.000.000 đ,,,"Phường 4, Quận 3, Tp Hồ Chí Minh","Xe honda còn zin 100%, xe 50cc nhưng vặn nhẹ là bay nha, máy móc đồ đạc nguyên zin, bán 24 tẹo nha, xem xe Quận 3, alo ochin33 ochin6 bay8chin có dép lào",Honda,Chaly,2010,50000,Đã sử dụng,Tay ga,50 - 100 cc,Nhật Bản,Bảo hành hãng,> 50 kg,https://xe.chotot.com/mua-ban-xe-may-quan-3-tp-ho-chi-minh/123747006.htm,2025-11-28 15:50:25,24.0,9.858089,1,Giá CAO bất thường. AI dự đoán: 9.86 tr. (Cao hơn 143%)
210,nhà dư xe nên e bán AB nhập thái 2009Fi chuẩn bstp,27.500.000 đ,8.6 tr,10.1 tr,"Phường 11, Quận 3, Tp Hồ Chí Minh","🌈AB nhập thái THÁI FI 2009 Biển Dễ Thương 1 Chủ 

➖#BS_2095( Bao Ký Uq sang tên 20 Năm ) 
➖Đk 2009 ( Đúng đời Fi )
➖xe người nhà đi ra chợ rồi đi về 
➖Máy Zin ( Bao Đầu Chưa Rớt )
➖dán keo xe nguyên chiếc 

💸 : trả giá thoải mái 

📲*** xem xe trực tiếp tại 
436/30 cách mạng T8 p.11 quận 3p",Honda,Air Blade,2009,32000,Đã sử dụng,Tay ga,100 - 175 cc,Việt Nam,Bảo hành hãng,> 50 kg,https://xe.chotot.com/mua-ban-xe-may-quan-3-tp-ho-chi-minh/123465564.htm,2025-11-28 15:50:25,27.5,11.253083,1,Giá CAO bất thường. AI dự đoán: 11.25 tr. (Cao hơn 144%)
215,Honda future1 2001- odo 16ngan km,50.500.000 đ,13.94 tr,16.37 tr,"Phường Võ Thị Sáu, Quận 3, Tp Hồ Chí Minh","Dư dùng , không chạy future1 -2001- odo 16 ngàn 
Xe zin nguyên chiếc , vỏ nguyên cặp chưa thay .
Chưa xúc bình xăng con , ai cần liên hệ , xe tôi đứng tên cavet . Giá 50t 500 thanks",Honda,Future,2001,16000,Đã sử dụng,Xe số,100 - 175 cc,Đang cập nhật,Bảo hành hãng,> 50 kg,https://xe.chotot.com/mua-ban-xe-may-quan-3-tp-ho-chi-minh/123588262.htm,2025-11-28 15:50:25,50.5,15.007139,1,Giá CAO bất thường. AI dự đoán: 15.01 tr. (Cao hơn 237%)
237,Bán xe cub 125,89.000.000 đ,74.65 tr,87.63 tr,"Phường Võ Thị Sáu, Quận 3, Tp Hồ Chí Minh","Do nữ đi muốn đổi sang xe ga có cốp xe nên muốn bán
Xe sx 2023, đăng kí 2024",Honda,Cub,2024,10060,Đã sử dụng,Xe số,100 - 175 cc,Thái Lan,Bảo hành hãng,> 50 kg,https://xe.chotot.com/mua-ban-xe-may-quan-3-tp-ho-chi-minh/123340397.htm,2025-11-28 15:50:25,89.0,41.76647,1,Giá CAO bất thường. AI dự đoán: 41.77 tr. (Cao hơn 113%)
238,Bán xe cho ai thật sự cần,295 đ,21.42 tr,25.14 tr,"Phường 12, Quận 3, Tp Hồ Chí Minh","Xe đk lần đâu 2018
Odo 14k km
Xe bảo dưỡng đầy đủ 
Chưa rớt đầu, ko đâm đụng
Còn gù và tay côn, xi nhan zin của xe
Vừa mới thay NSD DID, lốp sau
Xe chính chủ biển số quận 3, chỉ ký giấy mua bán 
Nhà dư dùng nên miễn Không tiếp cò lái mất thời gian
Có thương lượng cho ai thiện chí
Bán cho ai thật sự cần !
Ib hoặc kb zalo:*** chỉ nhận tin nhắn",Honda,MSX 125,2018,14000,Đã sử dụng,Tay côn/Moto,100 - 175 cc,Thái Lan,Bảo hành hãng,> 50 kg,https://xe.chotot.com/mua-ban-xe-may-quan-3-tp-ho-chi-minh/123447400.htm,2025-11-28 15:50:25,0.000295,17.658276,1,Giá RẺ bất thường. AI dự đoán: 17.66 tr. (Thấp hơn 100%)
241,Bán xe Cub 96 - 70cc,40.000.000 đ,8.52 tr,10 tr,"Phường Võ Thị Sáu, Quận 3, Tp Hồ Chí Minh","Cần bán xe Cub đời 1996, 70cc. Xe đăng ký 1 chủ từ lúc mới mua đến giờ.",Honda,Cub,1996,56000,Đã sử dụng,Xe số,50 - 100 cc,Đang cập nhật,Bảo hành hãng,> 50 kg,https://xe.chotot.com/mua-ban-xe-may-quan-3-tp-ho-chi-minh/123437158.htm,2025-11-28 15:50:25,40.0,12.509702,1,Giá CAO bất thường. AI dự đoán: 12.51 tr. (Cao hơn 220%)
247,"xe cub Custom cốp nỗi đèn vuông có đề 1996,90 cc",45.000.000 đ,8.52 tr,10 tr,"Quận 3, Tp Hồ Chí Minh",Bán xe cub custom đèn vuông có đề màu xanh nhớt một chủ mua mới từ đầu sang tên thoải mái xem xe Saigon q3,Honda,Cub,1996,30000,Đã sử dụng,Xe số,50 - 100 cc,Nhật Bản,Bảo hành hãng,> 50 kg,https://xe.chotot.com/mua-ban-xe-may-quan-3-tp-ho-chi-minh/123390387.htm,2025-11-28 15:50:25,45.0,12.615491,1,Giá CAO bất thường. AI dự đoán: 12.62 tr. (Cao hơn 257%)
252,Vespa LX 125 ie đèn vuông đời đầu phun xăng FI,13.000.000 đ,7.2 tr,8.45 tr,"Phường 5, Quận 3, Tp Hồ Chí Minh","Bán Piaggio LX 125 ie màu đen, đăng ký lần đầu 2011 bstp, odo 20.000km, xe rất ít khi chạy, xem xe, kiểm tra xe, mua bán tại nhà, giá mình bán 13tr",Piaggio,LX,2011,20000,Đã sử dụng,Tay ga,100 - 175 cc,Đang cập nhật,Bảo hành hãng,> 50 kg,https://xe.chotot.com/mua-ban-xe-may-quan-3-tp-ho-chi-minh/123338427.htm,2025-11-28 15:50:25,13.0,6.4353566,1,Giá CAO bất thường. AI dự đoán: 6.44 tr. (Cao hơn 102%)
256,Bán xe Future Neo GT 2007,32.000.000 đ,21.51 tr,25.25 tr,"Phường 5, Quận 3, Tp Hồ Chí Minh","Xe rất mới và đẹp, đời xe 2007
Xe màu đen và xám 
Biển số TP.HCM 
Giá bán : 32.000.000 ( giá ưu đãi cho anh/chị có thiện chí mua hàng )",Honda,Future,2007,75000,Đã sử dụng,Xe số,100 - 175 cc,Nhật Bản,Bảo hành hãng,> 50 kg,https://xe.chotot.com/mua-ban-xe-may-quan-3-tp-ho-chi-minh/121800258.htm,2025-11-28 15:50:25,32.0,16.694166,1,Giá CAO bất thường. AI dự đoán: 16.69 tr. (Cao hơn 92%)
258,Blade 50cc học sinh đi học,8.500.000 đ,6.24 tr,7.32 tr,"Phường 1, Quận 3, Tp Hồ Chí Minh","Giấy tờ đầy đủ bao tranh chấp đăng kí đời 2017
Xe máy im ru mạnh bóc
Biển số thành phố
Điện đề đầy đủ full chức năng
Kí hợp đồng mua bán rõ ràng khi giao dịch",Hãng khác,Dòng khác,2017,40000,Đã sử dụng,Xe số,Dưới 50 cc,Trung Quốc,Bảo hành hãng,> 50 kg,https://xe.chotot.com/mua-ban-xe-may-quan-3-tp-ho-chi-minh/123184881.htm,2025-11-28 15:50:25,8.5,4.339897,1,Giá CAO bất thường. AI dự đoán: 4.34 tr. (Cao hơn 96%)
264,Q3-Supper Dream 2005 Chính Chủ xe nhà sử dụng,18.500.000 đ,10.41 tr,12.22 tr,"Phường 10, Quận 3, Tp Hồ Chí Minh","Super Dream 2005
Xe nhà dư dùng nên bán.Chính Chủ sang tên,uy quyền 
Xe hiện trạng như hình
Xe có rớt đầu cạo khói
Suờn còn đẹp,cứng cáp .phần đuôi hơi mụt nhẹ
Máy êm ,nhẹ.
ACE có nhu cầu qua nhà xem trực tiếp cho tiện em để xe bên nhà vợ Q3 Trần Quốc Toản

 VÌ E Hay Đi Ngoài Đường,Làm Công Chuyện.Nên ACE Quan Tâm Thiện Chí Gọi E luôn Nha.Em Cảm Ơn
----/Àd duyệt giúp e ạ.em cảm ơn❤️",Honda,Dream,2005,58000,Đã sử dụng,Xe số,50 - 100 cc,Việt Nam,Bảo hành hãng,> 50 kg,https://xe.chotot.com/mua-ban-xe-may-quan-3-tp-ho-chi-minh/123148047.htm,2025-11-28 15:50:25,18.5,9.741059,1,Giá CAO bất thường. AI dự đoán: 9.74 tr. (Cao hơn 90%)
279,Vesp,24.000.000 đ,8.59 tr,10.08 tr,"Phường 8, Quận 4, Tp Hồ Chí Minh","Vespa vxl 125 cc không xử dụng ít đi đồng hồ 4500km không xử dụng nữa cần bán,hồ sơ cầm tay,chính chủ.",Piaggio,Vespa,2012,4500,Đã sử dụng,Tay ga,50 - 100 cc,Nước khác,Bảo hành hãng,> 50 kg,https://xe.chotot.com/mua-ban-xe-may-quan-4-tp-ho-chi-minh/124100364.htm,2025-11-28 15:50:25,24.0,10.651926,1,Giá CAO bất thường. AI dự đoán: 10.65 tr. (Cao hơn 125%)
282,bán xe máy ít chạy,13.000.000 đ,19.34 tr,22.71 tr,"Phường 8, Quận 4, Tp Hồ Chí Minh","Mua cho em gái ít có chạy , giờ không cần nên bán",Honda,Dòng khác,2017,131794,Đã sử dụng,Xe số,50 - 100 cc,Việt Nam,Bảo hành hãng,> 50 kg,https://xe.chotot.com/mua-ban-xe-may-quan-4-tp-ho-chi-minh/125005722.htm,2025-11-28 15:50:25,13.0,6.9515595,1,Giá CAO bất thường. AI dự đoán: 6.95 tr. (Cao hơn 87%)
287,Ex nhỏ ít chạy xe máy êm,55.000.000 đ,42.81 tr,50.25 tr,"Phường 3, Quận 4, Tp Hồ Chí Minh","Xe để nhà ít chạy bề ngoài đẹp.
Xe bao trach chấp",Yamaha,Exciter,2006,57000,Đã sử dụng,Xe số,100 - 175 cc,Việt Nam,Bảo hành hãng,> 50 kg,https://xe.chotot.com/mua-ban-xe-may-quan-4-tp-ho-chi-minh/124915578.htm,2025-11-28 15:50:25,55.0,27.111126,1,Giá CAO bất thường. AI dự đoán: 27.11 tr. (Cao hơn 103%)
294,Thanh lý xe gia đình,8.000.000 đ,3.89 tr,4.57 tr,"Phường 6, Quận 4, Tp Hồ Chí Minh","Cần bán xe gia đình 
Máy móc zin, máy êm không hú 
Biển SG dễ nhìn dễ nhớ 
Sang tên kí uỷ quyền bất cứ lúc nào",SYM,Joyride,2010,422560,Đã sử dụng,Tay ga,100 - 175 cc,Việt Nam,Bảo hành hãng,> 50 kg,https://xe.chotot.com/mua-ban-xe-may-quan-4-tp-ho-chi-minh/124769154.htm,2025-11-28 15:50:25,8.0,4.279109,1,Giá CAO bất thường. AI dự đoán: 4.28 tr. (Cao hơn 87%)
295,Sei Giorni 300 HPE,105.000.000 đ,43.05 tr,50.54 tr,"Phường 14, Quận 4, Tp Hồ Chí Minh","Chính chủ, thường xuyên đi bảo hành hãng. Do nhu cầu thay đổi, muốn sang nhượng lại bạn nào thích dòng này.",Piaggio,Vespa,2022,268888,Đã sử dụng,Tay ga,Trên 175 cc,Việt Nam,Bảo hành hãng,> 50 kg,https://xe.chotot.com/mua-ban-xe-may-quan-4-tp-ho-chi-minh/124713647.htm,2025-11-28 15:50:25,105.0,47.822453,1,Giá CAO bất thường. AI dự đoán: 47.82 tr. (Cao hơn 120%)
304,Đi mỹ bán xe nhà sd,14.500.000 đ,10.02 tr,11.76 tr,"Phường 13, Quận 4, Tp Hồ Chí Minh","Cần bán gấp xe nhà sử dụng , máy êm bảo đảm chạy bền sang đẹo",Honda,Air Blade,2011,600000,Đã sử dụng,Tay ga,50 - 100 cc,Nhật Bản,Bảo hành hãng,> 50 kg,https://xe.chotot.com/mua-ban-xe-may-quan-4-tp-ho-chi-minh/124325917.htm,2025-11-28 15:50:25,14.5,7.4787617,1,Giá CAO bất thường. AI dự đoán: 7.48 tr. (Cao hơn 94%)
338,SHi 109 đk 2012,210.000.000 đ,101.46 tr,119.11 tr,"Phường 16, Quận 4, Tp Hồ Chí Minh","Nhà chật bán bớt xe đang sử dụng tốt 
Máy móc nghiêm chỉnh chưa rớt đầu 
Sang tên uỷ quyền vô tư",Honda,SH,2012,12000,Đã sử dụng,Tay ga,100 - 175 cc,Nước khác,Bảo hành hãng,> 50 kg,https://xe.chotot.com/mua-ban-xe-may-quan-4-tp-ho-chi-minh/123677734.htm,2025-11-28 15:50:25,210.0,117.3364,1,Giá CAO bất thường. AI dự đoán: 117.34 tr. (Cao hơn 79%)
347,xe Wave,13.000.000 đ,6.93 tr,8.14 tr,"Phường 16, Quận 4, Tp Hồ Chí Minh",Xe đang đi BS 10 nút 🙂 chính chủ ký giây ủy quên mua bán đều được......,Honda,Wave,2006,49,Đã sử dụng,Xe số,50 - 100 cc,Việt Nam,Bảo hành hãng,> 50 kg,https://xe.chotot.com/mua-ban-xe-may-quan-4-tp-ho-chi-minh/123601266.htm,2025-11-28 15:50:25,13.0,7.3418016,1,Giá CAO bất thường. AI dự đoán: 7.34 tr. (Cao hơn 77%)
363,Bán xe Future Neo,29.000.000 đ,27.04 tr,31.74 tr,"Phường 2, Quận 4, Tp Hồ Chí Minh","Bán xe Future Neo đời đầu , không có phun xăng điện tử, xe chưa qua sữa chữa nguyên zin 100%, xe chính chủ biển số Thành phố",Honda,Future,2008,100000,Đã sử dụng,Xe số,100 - 175 cc,Việt Nam,Bảo hành hãng,> 50 kg,https://xe.chotot.com/mua-ban-xe-may-quan-4-tp-ho-chi-minh/123396588.htm,2025-11-28 15:50:25,29.0,14.916357,1,Giá CAO bất thường. AI dự đoán: 14.92 tr. (Cao hơn 94%)
366,MUA BÁN TRAO ĐỔI TẤT CẢ XE MÁY,1.234.567 đ,10.12 tr,11.88 tr,"Phường 6, Quận 4, Tp Hồ Chí Minh","✅ Shop E Còn Rất Nhiều Dòng Xe Máy SH125i - SH150i - SH300i - SH350i Đây Ạ
------------------🩸🩸🩸--------------------
 Shop E Còn Nhiều Xe Dòng SH Tất Cả Các Đời Cho ACE Thoải Mái Chọn Lựa
#Mua_Bán_Trao_Đổi_Tất_Cả_Xe_Máy_SH
Bên E Chuyên Mua Bán DòngSH150i- 125-300i-350i / Xe Nhập Ý Và Mẫu Ý Các Đời 
ACE Có Nhu Cầu Mua Bán Liên Hệ E Nhé
 ______________________
🔴 Hỗ Trợ Trả Gop Cho ACE Toàn Quốc 
MUA BÁN TRAO ĐỔI TẤT CẢ XE MÁY SH
☎️☎️☎️ ***
✅ Địa Chỉ : Lô K10 Cư Xá Vĩnh Hội P6 Q4",Honda,Dòng khác,2012,50000,Đã sử dụng,Tay ga,100 - 175 cc,Đang cập nhật,Bảo hành hãng,> 50 kg,https://xe.chotot.com/mua-ban-xe-may-quan-4-tp-ho-chi-minh/123360424.htm,2025-11-28 15:50:25,1.234567,10.767156,1,Giá RẺ bất thường. AI dự đoán: 10.77 tr. (Thấp hơn 89%)
