5095,Nouvo Gp 2015,15.000.000 đ,7.62 tr,8.94 tr,"Phường Linh Đông (Quận Thủ Đức cũ), Thành phố Thủ Đức, Tp Hồ Chí Minh","Xe ít đi còn chạy tốt
Xem xe ở Long An",Yamaha,Nouvo,2015,30000,Đã sử dụng,Tay ga,100 - 175 cc,Việt Nam,Bảo hành hãng,> 50 kg,https://xe.chotot.com/mua-ban-xe-may-thanh-pho-thu-duc-tp-ho-chi-minh/124748095.htm,2025-11-28 15:50:25,15.0,6.456038,1,Giá CAO bất thường. AI dự đoán: 6.46 tr. (Cao hơn 132%)
5107,"Xe ít đi, chưa hề làm máy, êm ái, thanh lịch...",35.000.000 đ,13.23 tr,15.53 tr,"Phường Hiệp Bình Phước (Quận Thủ Đức cũ), Thành phố Thủ Đức, Tp Hồ Chí Minh","Đang sử dụng tốt, máy zin chưa đụng tới, chạy ít vô cùng đi chợ thôi! Thanh lịch, bảnh bao, vỏ ngoài bảnh choẹ, nói chung không mua thì không biết nên mua gì nữa!",Honda,Future,2004,10500,Đã sử dụng,Xe số,100 - 175 cc,Việt Nam,Bảo hành hãng,> 50 kg,https://xe.chotot.com/mua-ban-xe-may-thanh-pho-thu-duc-tp-ho-chi-minh/124902154.htm,2025-11-28 15:50:25,35.0,16.864395,1,Giá CAO bất thường. AI dự đoán: 16.86 tr. (Cao hơn 108%)
5115,sh cần giao lưu qua vespa hoặc sh 350i,0 đ,62.14 tr,72.95 tr,"Phường Linh Trung (Quận Thủ Đức cũ), Thành phố Thủ Đức, Tp Hồ Chí Minh","cần giao lưu ạ do muôn đổi xe
cần giao lưu
giao lưu",Honda,SH,2019,50000,Đã sử dụng,Tay ga,100 - 175 cc,Đang cập nhật,Bảo hành hãng,> 50 kg,https://xe.chotot.com/mua-ban-xe-may-thanh-pho-thu-duc-tp-ho-chi-minh/124877092.htm,2025-11-28 15:50:25,0.0,42.400536,1,Giá nhập vào không hợp lệ
5118,Honda Shadow Spirit 750 đời 2008 Cực hiếm,235.000.000 đ,210.99 tr,247.68 tr,"Phường Hiệp Bình Phước (Quận Thủ Đức cũ), Thành phố Thủ Đức, Tp Hồ Chí Minh","Chính chủ cần bán. Odo 18.000km. Xe bảo dưỡng bảo trì tốt. Xe rất hiếm ở thị trường VN. Vì toàn người có tuổi có gu chơi thôi. Trẻ họ mua Fantom hết rồi. 
Pô Cobra chính hãng",Honda,Shadow,2008,180000,Đã sử dụng,Tay côn/Moto,Trên 175 cc,Đang cập nhật,Bảo hành hãng,> 50 kg,https://xe.chotot.com/mua-ban-xe-may-thanh-pho-thu-duc-tp-ho-chi-minh/124452064.htm,2025-11-28 15:50:25,235.0,74.28579,1,Giá CAO bất thường. AI dự đoán: 74.29 tr. (Cao hơn 216%)
5130,Xe Vespa Primavera 125i 2023 màu hồng 99%,69.990.000 đ,11.97 tr,14.05 tr,"Phường Thảo Điền (Quận 2 cũ), Thành phố Thủ Đức, Tp Hồ Chí Minh","- Xe vespa 125i đăng kí 2023
- odo 2000
- Liên hệ xem xe : ***",Hãng khác,Dòng khác,2023,2000,Đã sử dụng,Tay ga,100 - 175 cc,Đang cập nhật,Bảo hành hãng,> 50 kg,https://xe.chotot.com/mua-ban-xe-may-thanh-pho-thu-duc-tp-ho-chi-minh/124841212.htm,2025-11-28 15:50:25,69.99,30.021734,1,Giá CAO bất thường. AI dự đoán: 30.02 tr. (Cao hơn 133%)
5133,cần bán super cub,93.000.000 đ,11.08 tr,13.01 tr,"Phường Thảo Điền (Quận 2 cũ), Thành phố Thủ Đức, Tp Hồ Chí Minh","super cub odo siêu lướt 9 nghìn 500km nha ae
9xtr (x tiểu học nha ae)",Honda,Cub,2019,9500,Đã sử dụng,Xe số,100 - 175 cc,Đang cập nhật,Bảo hành hãng,> 50 kg,https://xe.chotot.com/mua-ban-xe-may-thanh-pho-thu-duc-tp-ho-chi-minh/124834811.htm,2025-11-28 15:50:25,93.0,23.487751,1,Giá CAO bất thường. AI dự đoán: 23.49 tr. (Cao hơn 296%)
5134,Excell 2 đồng hồ điện tử zin đét odo thấp,9.000.000 đ,3.5 tr,4.1 tr,"Phường Phước Long B (Quận 9 cũ), Thành phố Thủ Đức, Tp Hồ Chí Minh","Chuyển qua xe điện ko sử dụng tới cần để lại cho ACE có nhu cầu.
Excell 2 bản đồng hồ điện tử và đồng hồ kim báo tua máy.
Xe zin từ cặp kính.
Trầy xước nhẹ theo năm tháng. Ngoại hình 90%.
Cốp rộng hơn Lead, bao để đồ.
Xe full chức năng sử dụng tốt, máy móc êm bốc.
Nắp xăng bên ngoài tiện lợi.
Xe xác nặng, yên to đi đường trường đầm êm thích hợp cho người cao to hoặc mấy A Tây - Mỹ đen to bự.
Xăng tầm 30-40km/lít tùy vận hành.
Xe biển số đẹp dễ nhớ 54K2-2277. Ko chính chủ, giao cavet + viết giấy bao tranh chấp.
Nhanh gọn lẹ mình bớt mạnh tay cho ACE nhé.
ACE có nhu cầu xem xe gần ngã 4 Thủ Đức.",SYM,Dòng khác,2009,30000,Đã sử dụng,Tay ga,100 - 175 cc,Nước khác,Bảo hành hãng,> 50 kg,https://xe.chotot.com/mua-ban-xe-may-thanh-pho-thu-duc-tp-ho-chi-minh/124823754.htm,2025-11-28 15:50:25,9.0,4.858608,1,Giá CAO bất thường. AI dự đoán: 4.86 tr. (Cao hơn 85%)
5139,Bán xe AB đen cam Thái zin 2010 đầu 007,51.000.000 đ,12.64 tr,14.84 tr,"Phường An Phú (Quận 2 cũ), Thành phố Thủ Đức, Tp Hồ Chí Minh","Xe AB thái - đen cam, năm 2010, 
Xe zin 1 đời chủ chạy kỷ, đã thay 2 vỏ xe mới trước tết. 
Số máy APE-007xxxx
Dung tích xi lanh 108
Đăng ký 25/11/2010.
Xe đời cuối cùng nhập về VN, sau này khg nhập nữa.
Xe dán keo lâu khg lột ra - lúc tết 2025 lột bị tróc tem và sơn. Nên đã dơn và mua bộ tem dán lại hết 5tr hơn, có thay bố nồi còn lại zin tất cả kể cả yên xe và đồ nghề.",Honda,Air Blade,2010,72000,Đã sử dụng,Tay ga,100 - 175 cc,Thái Lan,Bảo hành hãng,> 50 kg,https://xe.chotot.com/mua-ban-xe-may-thanh-pho-thu-duc-tp-ho-chi-minh/124812757.htm,2025-11-28 15:50:25,51.0,19.821213,1,Giá CAO bất thường. AI dự đoán: 19.82 tr. (Cao hơn 157%)
5141,Bán dream Thái,69.000.000 đ,9.87 tr,11.59 tr,"Phường Hiệp Bình Chánh (Quận Thủ Đức cũ), Thành phố Thủ Đức, Tp Hồ Chí Minh","Không như cầu chia lại deam thái 1 chủ từ trước đến nay, xe mình chính chủ , xe zin 100%, máy móc thì thầm , km 39000, anh em cần liên hệ!",Honda,Dream,2000,39000,Đã sử dụng,Xe số,50 - 100 cc,Thái Lan,Bảo hành hãng,> 50 kg,https://xe.chotot.com/mua-ban-xe-may-thanh-pho-thu-duc-tp-ho-chi-minh/124800397.htm,2025-11-28 15:50:25,69.0,15.1221485,1,Giá CAO bất thường. AI dự đoán: 15.12 tr. (Cao hơn 356%)
5142,"Future X fi chỉnh chủ bstp bao zin, còn 2 chìa zin",35.000.000 đ,24.46 tr,28.71 tr,"Phường Phú Hữu (Quận 9 cũ), Thành phố Thủ Đức, Tp Hồ Chí Minh","Xe này ba mình đi sau đó để lại mình đi. Ban đầu mình đem về chơi nhưng do nhiều xe nên muốn bán. Xe nguyên zin, nguồn gốc rõ gàng, tem tiếc các kiểu còn đủ.
Xe kỷ niệm có sao để vậy chưa qua phục dựng
Coòn nguyên 2 chìa khoá zin theo xe
Xe đã hơn 10 năm nhưng vẫn còn chất riêng, rất đẹp.
Xe đi được 49000, bao kiểm tra.
Biển số thành phố, chính chủ đứng tên bao công chứng mua bán.
Xem xe tại nhà ở Quận 9",Honda,Future,2011,490000,Đã sử dụng,Xe số,100 - 175 cc,Đang cập nhật,Bảo hành hãng,> 50 kg,https://xe.chotot.com/mua-ban-xe-may-thanh-pho-thu-duc-tp-ho-chi-minh/122730886.htm,2025-11-28 15:50:25,35.0,13.385526,1,Giá CAO bất thường. AI dự đoán: 13.39 tr. (Cao hơn 161%)
5145,Honda CB-1( Cb400-nc27-98),80.000.000 đ,85.17 tr,99.98 tr,"Phường Long Bình (Quận 9 cũ), Thành phố Thủ Đức, Tp Hồ Chí Minh","Xe cũ theo thời gian, hiếm , nguyên bản, anh em mua trải nghiệm, sưu tầm. Xe HQCN , sang tên dịch vụ, lh: "" *** "", mình bán đúng giá này, ae thiện hoặc lấy ngay thì mình fix mạnh xe giờ khó kiếm lắm nên mong không kì kèo trả giá khó khăn nhau",Honda,CB,2018,30000,Đã sử dụng,Tay côn/Moto,Trên 175 cc,Nhật Bản,Bảo hành hãng,> 50 kg,https://xe.chotot.com/mua-ban-xe-may-thanh-pho-thu-duc-tp-ho-chi-minh/124785122.htm,2025-11-28 15:50:25,80.0,37.866257,1,Giá CAO bất thường. AI dự đoán: 37.87 tr. (Cao hơn 111%)
5146,Super cub xxm trùm mền,83.000.000 đ,11.08 tr,13.01 tr,"Phường Hiệp Phú (Quận 9 cũ), Thành phố Thủ Đức, Tp Hồ Chí Minh","Super cub màu xanh xi măng ít đi odo chỉ 6000, trùm mền vì nhà nhiều xe. Đồ chơi theo xe nhiều, xe nguyên zin bọc keo nguyên chiếc. Ae nào mua vui vẻ mình tặng thêm hết đồ phụ kiện. Xem xe tp thuduc nhà riêng",Honda,Cub,2019,6000,Đã sử dụng,Xe số,100 - 175 cc,Đang cập nhật,Bảo hành hãng,> 50 kg,https://xe.chotot.com/mua-ban-xe-may-thanh-pho-thu-duc-tp-ho-chi-minh/124775255.htm,2025-11-28 15:50:25,83.0,24.079796,1,Giá CAO bất thường. AI dự đoán: 24.08 tr. (Cao hơn 245%)
5150,Chính chủ cần bán Winner V1 2018,22.000.000 đ,14.49 tr,17.01 tr,"Phường Phước Bình (Quận 9 cũ), Thành phố Thủ Đức, Tp Hồ Chí Minh","Chính chủ cần bán Winner v1 màu đỏ trắng đời 2018.
Xe biển số thành phố. Mình chạy kĩ đi làm hằng ngày. Sử dụng nhớt tổng hợp 2000km thay. Nước mát 1 năm thay 1 lần. 
Xe đã lên mâm 6 cây, khoá smk, mạch tăng sáng…tất cả đồ zin còn đầy đủ
Xe mới thay nsd và cặp vỏ, bạc đạn bánh, bố thắng hồi tháng 1/2025
Xem xe trong giờ hành chính ở thủ đức, quận 9. Ngoài giờ thì ở q1, q10",Honda,Winner,2018,100000,Đã sử dụng,Tay côn/Moto,100 - 175 cc,Việt Nam,Bảo hành hãng,> 50 kg,https://xe.chotot.com/mua-ban-xe-may-thanh-pho-thu-duc-tp-ho-chi-minh/124753489.htm,2025-11-28 15:50:25,22.0,12.16809,1,Giá CAO bất thường. AI dự đoán: 12.17 tr. (Cao hơn 81%)
5151,🔆🆘 KẸT BÁN xe Suzuki GSX S1000 chỉ 190tr,190.000.000 đ,,,"Phường Long Bình (Quận 9 cũ), Thành phố Thủ Đức, Tp Hồ Chí Minh","Xe nhà đi ít- chính chủ bán - thương lượng thêm cho kh thiện chí 
Anh chị quan tâm nt bên zlo nha : *** - do em ít online trên đây 🙂",Suzuki,GSX,2015,18000,Đã sử dụng,Tay côn/Moto,Trên 175 cc,Nhật Bản,Bảo hành hãng,> 50 kg,https://xe.chotot.com/mua-ban-xe-may-thanh-pho-thu-duc-tp-ho-chi-minh/122943325.htm,2025-11-28 15:50:25,190.0,66.50899,1,Giá CAO bất thường. AI dự đoán: 66.51 tr. (Cao hơn 186%)
5156,CẦN BÁN EM SH THÂN YÊU,90.000.000 đ,74.3 tr,87.23 tr,"Phường An Phú (Quận 2 cũ), Thành phố Thủ Đức, Tp Hồ Chí Minh","Mình cần bán em xe cưng chiều, chăm chút cực kỹ của mình. Chất xe mới nguyên zin 1 đời chủ từ đầu. Xe chất đẹp thay nhớt vảo dưỡng lớn nhỏ đầy đủ",Honda,SH,2022,21250,Đã sử dụng,Xe số,100 - 175 cc,Việt Nam,Bảo hành hãng,> 50 kg,https://xe.chotot.com/mua-ban-xe-may-thanh-pho-thu-duc-tp-ho-chi-minh/124741605.htm,2025-11-28 15:50:25,90.0,29.027302,1,Giá CAO bất thường. AI dự đoán: 29.03 tr. (Cao hơn 210%)
5161,Cần bán trong tháng 5,30.000.000 đ,11.35 tr,13.32 tr,"Phường Hiệp Bình Phước (Quận Thủ Đức cũ), Thành phố Thủ Đức, Tp Hồ Chí Minh","Cần bán cub custom 70cc odo 35.000 km, Xe đứng tên công ty nhưng giờ công ty ngừng hoạt động rồi nên sang tên có bị phạt là sang tên người mới bấm biển lại được",Honda,Cub,1993,35000,Đã sử dụng,Xe số,50 - 100 cc,Nhật Bản,Bảo hành hãng,> 50 kg,https://xe.chotot.com/mua-ban-xe-may-thanh-pho-thu-duc-tp-ho-chi-minh/124728449.htm,2025-11-28 15:50:25,30.0,12.618647,1,Giá CAO bất thường. AI dự đoán: 12.62 tr. (Cao hơn 138%)
5163,Cần bán Kawasaki Versys 650,179.000.000 đ,,,"Phường Thạnh Mỹ Lợi (Quận 2 cũ), Thành phố Thủ Đức, Tp Hồ Chí Minh","Cảm ơn ad đã duyệt bài
Mình cần bán Versys 650 lướt 9k
Đủ đồ đi tour, mua về chỉ đi. (Bao test hãng)
Giá trên xe zin
Đồ chơi
- Ốp gầm SW- Motech
- Chống đỗ Givi trước
- Giá đỡ điện thoại OsoPro
- Khung gắn thùng sau givi
- Chân chống đứng
- Bộ sạc nhanh
- cặp trợ sáng l7
- Thùng nhôm 20l

Kèm đồ chơi rẻ hơn xe hãng lăn bánh hcm gần 50tr lướt chỉ hơn 9k

Nhận giao lưu Tracer 9 odo <10k
Điện thoại: *** Phong (TL trực tiếp)",Kawasaki,Dòng khác,2023,9500,Đã sử dụng,Tay côn/Moto,Trên 175 cc,Đang cập nhật,Bảo hành hãng,> 50 kg,https://xe.chotot.com/mua-ban-xe-may-thanh-pho-thu-duc-tp-ho-chi-minh/124727428.htm,2025-11-28 15:50:25,179.0,74.113785,1,Giá CAO bất thường. AI dự đoán: 74.11 tr. (Cao hơn 142%)
5164,"Super Dream 2002. Chính chủ ký, đã dọn",25.000.000 đ,9.23 tr,10.84 tr,"Phường Thạnh Mỹ Lợi (Quận 2 cũ), Thành phố Thủ Đức, Tp Hồ Chí Minh","Super Dream chính chủ. Đã dọn, đã qua sử dụng cần bán ( bao công chứng) Super Dream chính chủ",Honda,Dream,2002,59000,Đã sử dụng,Xe số,100 - 175 cc,Việt Nam,Bảo hành hãng,> 50 kg,https://xe.chotot.com/mua-ban-xe-may-thanh-pho-thu-duc-tp-ho-chi-minh/124724045.htm,2025-11-28 15:50:25,25.0,11.318456,1,Giá CAO bất thường. AI dự đoán: 11.32 tr. (Cao hơn 121%)
5172,nhà dư cần bán xe nmx còn mới zin tất cả,44.000.000 đ,,,"Phường Phú Hữu (Quận 9 cũ), Thành phố Thủ Đức, Tp Hồ Chí Minh",xe zin 100% ít đi.dư nên cần bán.k phải cua,Yamaha,NM-X,2016,14000,Đã sử dụng,Tay ga,100 - 175 cc,Nhật Bản,Bảo hành hãng,> 50 kg,https://xe.chotot.com/mua-ban-xe-may-thanh-pho-thu-duc-tp-ho-chi-minh/124692903.htm,2025-11-28 15:50:25,44.0,12.270495,1,Giá CAO bất thường. AI dự đoán: 12.27 tr. (Cao hơn 259%)
5186,Bán Cub 50cc Nhật,22.000.000 đ,11.1 tr,13.03 tr,"Phường Linh Xuân (Quận Thủ Đức cũ), Thành phố Thủ Đức, Tp Hồ Chí Minh","cub nhật
chức năng đầy đủ ,còn sd đc xi nhan pha hậu 
chìa khoá zin, 1 chìa
xe chính chủ 
còn bững che nhưng đã tháo, ai mua thì đưa lại
đề, đạp nhẹ là nổ
tiết kiệm xăng
Thiện chí thì bớt cafe",Honda,Cub,1994,10000,Đã sử dụng,Xe số,Dưới 50 cc,Nhật Bản,Bảo hành hãng,> 50 kg,https://xe.chotot.com/mua-ban-xe-may-thanh-pho-thu-duc-tp-ho-chi-minh/124669637.htm,2025-11-28 15:50:25,22.0,10.528798,1,Giá CAO bất thường. AI dự đoán: 10.53 tr. (Cao hơn 109%)
5191,ex 2008,68.000.000 đ,41.72 tr,48.97 tr,"Phường Phước Long A (Quận 9 cũ), Thành phố Thủ Đức, Tp Hồ Chí Minh","do dư dùng cần bán ex 208 xe chỉnh chủ đứng bán 
xe dọn kiểng mâm daytona phuộc onlins heo brembo 2 piss đĩa tq6
vv....
ae nào có nhu cầu xin liên hệ trực tiếp",Yamaha,Exciter,2008,100000,Đã sử dụng,Xe số,100 - 175 cc,Việt Nam,Bảo hành hãng,> 50 kg,https://xe.chotot.com/mua-ban-xe-may-thanh-pho-thu-duc-tp-ho-chi-minh/124619365.htm,2025-11-28 15:50:25,68.0,22.624304,1,Giá CAO bất thường. AI dự đoán: 22.62 tr. (Cao hơn 201%)
5195,Harley Davidson Streetglide special US chính chủ,886.000.000 đ,815.12 tr,956.88 tr,"Phường An Khánh (Quận 2 cũ), Thành phố Thủ Đức, Tp Hồ Chí Minh","Xe Street Glide Special bản nhập Mỹ . Odo 40k. Bs hcm. Xe chính chủ đi kỹ bảo dưỡng đầy đủ bao check hãng đẹp. Đồ chơi gồm có:
1.Phuộc trước olins
2. Phuộc sau Screamin Eagle (màu đen)
3. Full set po S&S
4. 4 loa stage 2
5.Ghi đông factory 14
6. Số lùi mamba
7. Bao tay sưởi CVO
8. Yên CVO
9. Kính chiếu hậu CVO
10.Thùng top sau 
11.Kính chắn gió.
12.Cặp đèn sừng chính hãng 
13.Đèn mí tích hợp xi nhan
14.Đèn lái chính đồ chơi 
15.Xi nhan thùng sau.
16.Xi nhan trước đồ chơi 
17.Còi police (japan)
18.Quạt tản nhiệt & Miếng che nóng 
19.Dây tăng áp đồ chơi 
20.bơm nhớt lớn 
21.Full chống đổ trước sau
22.Lọc gió đồ chơi
23.Áp suất lốp (Tich hợp trong xe)
24.Đồ linh tinh….
Chính chủ đi kỹ xem xe tại nhà. Tks mọi ng đã xem tin",Harley Davidson,Touring,2019,40000,Đã sử dụng,Tay côn/Moto,Trên 175 cc,Mỹ,Bảo hành hãng,> 50 kg,https://xe.chotot.com/mua-ban-xe-may-thanh-pho-thu-duc-tp-ho-chi-minh/124626518.htm,2025-11-28 15:50:25,886.0,130.17416,1,Giá CAO bất thường. AI dự đoán: 130.17 tr. (Cao hơn 581%)
5198,Xe wave han vo 1con xin,9.500.000 đ,4.18 tr,4.91 tr,"Phường Phước Long B (Quận 9 cũ), Thành phố Thủ Đức, Tp Hồ Chí Minh",Mình cần bản xe như hình xe giấy trung quốc da vo 1 con xin cần tiền bản xe kg chính chu còn giấy của hang lúc mua bao tranh chap tron doi ai can alo cam on cho tốt,Hãng khác,Dòng khác,2004,15000,Đã sử dụng,Xe số,100 - 175 cc,Trung Quốc,Bảo hành hãng,> 50 kg,https://xe.chotot.com/mua-ban-xe-may-thanh-pho-thu-duc-tp-ho-chi-minh/124605480.htm,2025-11-28 15:50:25,9.5,4.2948446,1,Giá CAO bất thường. AI dự đoán: 4.29 tr. (Cao hơn 121%)
5200,Vento 150cc xe nhập bstp đẹp tứ quý 8888 có Gl nha,83.500.000 đ,76.82 tr,90.18 tr,"Phường Cát Lái (Quận 2 cũ), Thành phố Thủ Đức, Tp Hồ Chí Minh","Để nhà ít chạy nên thanh lý e này cho ae phong thủy chơi biển số , bao ủy quyền trọn đời 

Vento reblian 150cc 

Hàng nhập khẩu , máy móc bao êm đã đại tu toàn bộ như xe mới , k hư hỏng vặt

Ae thích độ ngầu và chạy đường dài lợi xăng thì ib nha 

Có nhận GL các loại xe bù trừ 🥰",Vento,Rebellian,2009,50000,Đã sử dụng,Tay côn/Moto,100 - 175 cc,Mỹ,Bảo hành hãng,> 50 kg,https://xe.chotot.com/mua-ban-xe-may-thanh-pho-thu-duc-tp-ho-chi-minh/124603807.htm,2025-11-28 15:50:25,83.5,46.95309,1,Giá CAO bất thường. AI dự đoán: 46.95 tr. (Cao hơn 78%)
5206,Bán xe Future GT 2009,36.500.000 đ,26.52 tr,31.14 tr,"Phường Hiệp Phú (Quận 9 cũ), Thành phố Thủ Đức, Tp Hồ Chí Minh","Bán xe như hình. Chính chủ, giấy tờ đầy đủ. Xe tâm huyết. 
Ai thích liên hệ mình nhé.",Honda,Future,2009,24000,Đã sử dụng,Xe số,100 - 175 cc,Đang cập nhật,Bảo hành hãng,> 50 kg,https://xe.chotot.com/mua-ban-xe-may-thanh-pho-thu-duc-tp-ho-chi-minh/124585963.htm,2025-11-28 15:50:25,36.5,17.70288,1,Giá CAO bất thường. AI dự đoán: 17.70 tr. (Cao hơn 106%)
5208,Vespa Sprint 2015 mix full trắng,41.000.000 đ,22.2 tr,26.06 tr,"Phường Bình Thọ (Quận Thủ Đức cũ), Thành phố Thủ Đức, Tp Hồ Chí Minh","40 Triệu thôi mà đẹp như này 🥹 Mọi người quan tâm liên hệ em ạ ❤️

- Vespa Sprint 2015 mix full trắng 📸

Xe chính chủ sang tên công chứng toàn quốc và có bảo hành máy móc 1 năm ạ 💎",Piaggio,Vespa,2015,20000,Đã sử dụng,Tay ga,100 - 175 cc,Đang cập nhật,Bảo hành hãng,> 50 kg,https://xe.chotot.com/mua-ban-xe-may-thanh-pho-thu-duc-tp-ho-chi-minh/124579684.htm,2025-11-28 15:50:25,41.0,16.843128,1,Giá CAO bất thường. AI dự đoán: 16.84 tr. (Cao hơn 143%)
5220,Xe Yamaha Acruzo đẹp,14.000.000 đ,11.68 tr,13.71 tr,"Phường An Phú (Quận 2 cũ), Thành phố Thủ Đức, Tp Hồ Chí Minh","Em có chiếc xe Acruzo yamaha máy êm,khỏe,hình thức đẹp muốn nhượng lại cho ai cần sử dụng.
Xe em để đi nên em có trang trí thêm phụ kiện cho xe tương đối đẹp ạ.
Anh chị mà mua về để đi chơi,công việc thì rất ok nhé ạ.
Xe có thể ký công chứng - ủy quyền nếu cần ạ.
Em cảm ơn mọi người đã đọc tin ạ.
Cảm ơn chợ tốt ạ.",Yamaha,Acruzo,2015,70000,Đã sử dụng,Tay ga,100 - 175 cc,Nhật Bản,Bảo hành hãng,> 50 kg,https://xe.chotot.com/mua-ban-xe-may-thanh-pho-thu-duc-tp-ho-chi-minh/124538941.htm,2025-11-28 15:50:25,14.0,7.5350666,1,Giá CAO bất thường. AI dự đoán: 7.54 tr. (Cao hơn 86%)
5222,Vespa GTS Full Màu Đen Nhám,30.000.000 đ,17.23 tr,20.23 tr,"Phường An Phú (Quận 2 cũ), Thành phố Thủ Đức, Tp Hồ Chí Minh","Xe sơn mới nguyên con như ảnh , máy móc nguyên zin , giấy tờ sang tên bấm bs mới toàn quốc",Piaggio,Vespa,2014,22000,Đã sử dụng,Tay ga,100 - 175 cc,Việt Nam,Bảo hành hãng,> 50 kg,https://xe.chotot.com/mua-ban-xe-may-thanh-pho-thu-duc-tp-ho-chi-minh/124339295.htm,2025-11-28 15:50:25,30.0,15.836666,1,Giá CAO bất thường. AI dự đoán: 15.84 tr. (Cao hơn 89%)
5231,"Xe vespa GT, Cosa",100.000.000 đ,22.48 tr,26.39 tr,"Phường Bình Trưng Tây (Quận 2 cũ), Thành phố Thủ Đức, Tp Hồ Chí Minh","NHà dư xe, không sử dụng nữa, cần bán GT, Cosa, GTS lien hệ ***",Hãng khác,Dòng khác,trước năm 1980,12,Đã sử dụng,Tay côn/Moto,100 - 175 cc,Nước khác,Bảo hành hãng,> 50 kg,https://xe.chotot.com/mua-ban-xe-may-thanh-pho-thu-duc-tp-ho-chi-minh/124489881.htm,2025-11-28 15:50:25,100.0,30.142921,1,Giá CAO bất thường. AI dự đoán: 30.14 tr. (Cao hơn 232%)
5233,chính chủ bán xe bmw r nite t,400.000.000 đ,368 tr,432 tr,"Phường An Phú (Quận 2 cũ), Thành phố Thủ Đức, Tp Hồ Chí Minh","Bán xe bmw r nite t date 2020 odo 4000km, xe ít chạy chỉ cf cuối tuần chưa đi tua. Xe keng đẹp zing nguyên con",BMW,R nine T,2020,4000,Đã sử dụng,Tay côn/Moto,Không biết rõ,Đức,Bảo hành hãng,> 50 kg,https://xe.chotot.com/mua-ban-xe-may-thanh-pho-thu-duc-tp-ho-chi-minh/124471087.htm,2025-11-28 15:50:25,400.0,17.87311,1,Giá CAO bất thường. AI dự đoán: 17.87 tr. (Cao hơn 2138%)
5237,Ex 5p71 bstp 9c máy zin đẹp,53.000.000 đ,41.61 tr,48.85 tr,"Phường Linh Đông (Quận Thủ Đức cũ), Thành phố Thủ Đức, Tp Hồ Chí Minh","Xe ít đi cần bán lại 5p71 côn tay máy êm bô tóc tóc
Bstp 9chu em đứng tên 
Xe máy êm ngon zin về chỉ việc đổ xăng chạy
Ae cần qua xem trực tiếp thương lượng !!!",Yamaha,Exciter,2010,9999,Đã sử dụng,Tay côn/Moto,100 - 175 cc,Việt Nam,Bảo hành hãng,> 50 kg,https://xe.chotot.com/mua-ban-xe-may-thanh-pho-thu-duc-tp-ho-chi-minh/124387263.htm,2025-11-28 15:50:25,53.0,27.531157,1,Giá CAO bất thường. AI dự đoán: 27.53 tr. (Cao hơn 93%)
5242,có chiếc xe do real full xe,70.000.000 đ,14.31 tr,16.8 tr,"Phường Linh Chiểu (Quận Thủ Đức cũ), Thành phố Thủ Đức, Tp Hồ Chí Minh",do đổi xe khac nên muốn bán lại số dep đồ real nguyen xe chính chủ uy quyen thoải mai,Honda,Wave,2022,30000,Đã sử dụng,Xe số,100 - 175 cc,Việt Nam,Bảo hành hãng,> 50 kg,https://xe.chotot.com/mua-ban-xe-may-thanh-pho-thu-duc-tp-ho-chi-minh/124425698.htm,2025-11-28 15:50:25,70.0,16.059355,1,Giá CAO bất thường. AI dự đoán: 16.06 tr. (Cao hơn 336%)
5254,"Cần bán ex 72+7 chính chủ bstp, máy mới làm",31.500.000 đ,14.95 tr,17.54 tr,"Phường Tăng Nhơn Phú B (Quận 9 cũ), Thành phố Thủ Đức, Tp Hồ Chí Minh","máy móc bao êm có fixx nhanh lẹ 
xe 43hp bàn brt",Yamaha,Exciter,2016,60000,Đã sử dụng,Tay côn/Moto,100 - 175 cc,Việt Nam,Bảo hành hãng,> 50 kg,https://xe.chotot.com/mua-ban-xe-may-thanh-pho-thu-duc-tp-ho-chi-minh/124365200.htm,2025-11-28 15:50:25,31.5,15.980949,1,Giá CAO bất thường. AI dự đoán: 15.98 tr. (Cao hơn 97%)
5259,novo 4 dọn mới leng keng bstp gtdd,8.000.000 đ,3.15 tr,3.69 tr,"Phường Phước Long B (Quận 9 cũ), Thành phố Thủ Đức, Tp Hồ Chí Minh","xe y như hình ảnh 
máy up 150 êm mạnh
ae đến test xe trực tiếp",Yamaha,Nouvo,2008,10000,Đã sử dụng,Tay ga,100 - 175 cc,Việt Nam,Bảo hành hãng,> 50 kg,https://xe.chotot.com/mua-ban-xe-may-thanh-pho-thu-duc-tp-ho-chi-minh/124342912.htm,2025-11-28 15:50:25,8.0,4.0833225,1,Giá CAO bất thường. AI dự đoán: 4.08 tr. (Cao hơn 96%)
5277,Cub nhật 50cc,20.000.000 đ,11.1 tr,13.03 tr,"Phường Linh Xuân (Quận Thủ Đức cũ), Thành phố Thủ Đức, Tp Hồ Chí Minh","xe còn ngon máy mượt
đề bấm nhẹ là nổ
pô êm
chức năng đầy đủ kh lỗi lầm 
ms thay nhớt 
còn bửng che đang cất
chiìa khoá zin theo xe
xem xe tại nhà
bao sang tên",Honda,Cub,1994,10000,Đã sử dụng,Xe số,Dưới 50 cc,Nhật Bản,Bảo hành hãng,> 50 kg,https://xe.chotot.com/mua-ban-xe-may-thanh-pho-thu-duc-tp-ho-chi-minh/124259431.htm,2025-11-28 15:50:25,20.0,10.528798,1,Giá CAO bất thường. AI dự đoán: 10.53 tr. (Cao hơn 90%)
5286,si54zz full kiểng mới dọn xongg lh e ngay ạ,13.500.000 đ,6.37 tr,7.48 tr,"Phường Hiệp Bình Chánh (Quận Thủ Đức cũ), Thành phố Thủ Đức, Tp Hồ Chí Minh","Xe mới làm , ae nào mua nhấc máy gọi, bao thầy thợ tét máy,xe ngonn thì tiền cao",Yamaha,Sirius,2011,10000,Đã sử dụng,Xe số,100 - 175 cc,Nhật Bản,Bảo hành hãng,> 50 kg,https://xe.chotot.com/mua-ban-xe-may-thanh-pho-thu-duc-tp-ho-chi-minh/124206220.htm,2025-11-28 15:50:25,13.5,6.308796,1,Giá CAO bất thường. AI dự đoán: 6.31 tr. (Cao hơn 114%)
5291,Honda Cub Custom 70,45.000.000 đ,9.46 tr,11.11 tr,"Phường An Phú (Quận 2 cũ), Thành phố Thủ Đức, Tp Hồ Chí Minh","Bán xe Honda Cub Custom 70 đời cao, xe zin nguyên bản, giấy tờ đi đường.
Hiện trạng xe cứng cáp zin từng con ốc.
Giá thương lượng nhẹ.",Honda,Cub,2018,5379,Đã sử dụng,Xe số,50 - 100 cc,Nhật Bản,Bảo hành hãng,> 50 kg,https://xe.chotot.com/mua-ban-xe-may-thanh-pho-thu-duc-tp-ho-chi-minh/124187207.htm,2025-11-28 15:50:25,45.0,10.610466,1,Giá CAO bất thường. AI dự đoán: 10.61 tr. (Cao hơn 324%)
