1781,"bán ex 206 máy thái 9chủ, máy êm",45.500.000 đ,42.81 tr,50.25 tr,"Phường Tân Thới Nhất, Quận 12, Tp Hồ Chí Minh","Bán ex 1s94 máy thái 206 - 9chủ chưa kí lần nào. Định danh GA , màu theo cavet luôn ( đúng đời số tự động ) 
 , xe nhà chạy thanh lí rộng nhà thôi . Giá đẹp thì chốt khỏi thương lượng nhiều, nhanh lẹ thì bán nhanh lẹ, 
1 số đồ chơi như hình , đồng hồ, căm đùm niền excel , phuộc bình dầu đồ chơi, full ốc salaya , bô nổ tóc tóc.",Yamaha,Exciter,2006,10,Đã sử dụng,Xe số,100 - 175 cc,Việt Nam,Bảo hành hãng,> 50 kg,https://xe.chotot.com/mua-ban-xe-may-quan-12-tp-ho-chi-minh/125051666.htm,2025-11-28 15:50:25,45.5,25.938763,1,Giá CAO bất thường. AI dự đoán: 25.94 tr. (Cao hơn 75%)
1817,CẦN BÁN SH Ý 150 107 Đk 2011 Bs 099.09,179.000.000 đ,111.87 tr,131.33 tr,"Phường Trung Mỹ Tây, Quận 12, Tp Hồ Chí Minh","Cần Bán SH 150i Ý Nhập , Sm 107 đầu . 2011 Trắng sporty 
……. Xe Biển Số Dễ Nhìn … 09909

✅ Chất xe zin dàn đồ đẹp , Chao đầu chưa mở , đường nước zin nhẹ nhàng cục máy bao tê- Vỏ Dunlop 😘",Honda,SH,2011,19000,Đã sử dụng,Tay ga,100 - 175 cc,Đang cập nhật,Bảo hành hãng,> 50 kg,https://xe.chotot.com/mua-ban-xe-may-quan-12-tp-ho-chi-minh/123963838.htm,2025-11-28 15:50:25,179.0,97.80703,1,Giá CAO bất thường. AI dự đoán: 97.81 tr. (Cao hơn 83%)
1826,Bán xe moto MT15,58.000.000 đ,51.19 tr,60.09 tr,"Phường Tân Chánh Hiệp, Quận 12, Tp Hồ Chí Minh","Xe còn mới 90%, ít đi, thiện chí liên hệ : A Hải *** chính chủ",Yamaha,MT,2021,6068,Đã sử dụng,Tay côn/Moto,100 - 175 cc,Thái Lan,Bảo hành hãng,> 50 kg,https://xe.chotot.com/mua-ban-xe-may-quan-12-tp-ho-chi-minh/125087663.htm,2025-11-28 15:50:25,58.0,30.914772,1,Giá CAO bất thường. AI dự đoán: 30.91 tr. (Cao hơn 88%)
1827,Fu x fi 2010 cọp,55.900.000 đ,25.66 tr,30.12 tr,"Phường Tân Chánh Hiệp, Quận 12, Tp Hồ Chí Minh",Xe nhà mua mới từ đầu.2010.2vo zin gai dầy.2 chìa khóa.+ chưa sài.máy mốc nguyên zin từng con ốc.nhông sên đĩa chưa thay.nói chung là bao zin 100% ko lai bất cứ gì.biển sài gòn 4 số.mua bán tại nhà.công chứng qh h.ae đam mê nhấc cái máy alo mình.ủy quyền mua bán đều nhanh lẹ.ae đam mê thì alo mình.còn tào lao né dùm nha.còn tin là còn,Honda,Future,2010,19100,Đã sử dụng,Xe số,100 - 175 cc,Việt Nam,Bảo hành hãng,> 50 kg,https://xe.chotot.com/mua-ban-xe-may-quan-12-tp-ho-chi-minh/125080191.htm,2025-11-28 15:50:25,55.9,18.071493,1,Giá CAO bất thường. AI dự đoán: 18.07 tr. (Cao hơn 209%)
1834,Chia tay đam mê- Future X xăng cơ,30.000.000 đ,24.61 tr,28.89 tr,"Phường Tân Hưng Thuận, Quận 12, Tp Hồ Chí Minh","Cục máy zin
Biển số 81
Ngoại hình như hình
Ae mua về chỉ đổ xăng là chạy",Honda,Future,2011,60000,Đã sử dụng,Xe số,100 - 175 cc,Nhật Bản,Bảo hành hãng,> 50 kg,https://xe.chotot.com/mua-ban-xe-may-quan-12-tp-ho-chi-minh/125049079.htm,2025-11-28 15:50:25,30.0,14.204834,1,Giá CAO bất thường. AI dự đoán: 14.20 tr. (Cao hơn 111%)
1836,BÁN XE AIR BLADE( Hon da AB thái),45.000.000 đ,8.99 tr,10.56 tr,"Phường Trung Mỹ Tây, Quận 12, Tp Hồ Chí Minh","Xe Ab thái 2012 màu Vàng đen ( đồng) còn zin.
Chính chủ",Honda,Air Blade,2012,20000,Đã sử dụng,Tay ga,100 - 175 cc,Thái Lan,Bảo hành hãng,> 50 kg,https://xe.chotot.com/mua-ban-xe-may-quan-12-tp-ho-chi-minh/125051774.htm,2025-11-28 15:50:25,45.0,19.1822,1,Giá CAO bất thường. AI dự đoán: 19.18 tr. (Cao hơn 135%)
1840,Xe cub 78,1.500.000 đ,6.82 tr,8.01 tr,"Phường Hiệp Thành, Quận 12, Tp Hồ Chí Minh","Xe cub78 
09chủ 
sdt *** 
Tặng ae sườn MD50 còn đẹp cứng",Honda,Cub,trước năm 1980,9999,Đã sử dụng,Xe số,Dưới 50 cc,Nhật Bản,Bảo hành hãng,> 50 kg,https://xe.chotot.com/mua-ban-xe-may-quan-12-tp-ho-chi-minh/125036349.htm,2025-11-28 15:50:25,1.5,8.24866,1,Giá RẺ bất thường. AI dự đoán: 8.25 tr. (Thấp hơn 82%)
1853,wave anpha bstp 9c,15.000.000 đ,10.55 tr,12.38 tr,"Phường Trung Mỹ Tây, Quận 12, Tp Hồ Chí Minh",Wave anpha dàn áo zx trùng màu cavet bstp 9c ngay chủ máy êm ru chưa rửa,Honda,Wave,2002,100000,Đã sử dụng,Xe số,50 - 100 cc,Việt Nam,Bảo hành hãng,> 50 kg,https://xe.chotot.com/mua-ban-xe-may-quan-12-tp-ho-chi-minh/124982972.htm,2025-11-28 15:50:25,15.0,7.3135405,1,Giá CAO bất thường. AI dự đoán: 7.31 tr. (Cao hơn 105%)
1861,Chiếc cub 81 zin mộc chính chủ,18.000.000 đ,7.53 tr,8.84 tr,"Phường Tân Thới Hiệp, Quận 12, Tp Hồ Chí Minh","Chiếc cub 81 màu bã đậu, zin mộc chính chủ biển Q1 tphcm.
Thích hợp sưu tầm hoài niệm cafe nhẹ nhàng...anh chị cần liên lạc trực tiếp.",Honda,Cub,2009,29999,Đã sử dụng,Xe số,Dưới 50 cc,Nhật Bản,Bảo hành hãng,> 50 kg,https://xe.chotot.com/mua-ban-xe-may-quan-12-tp-ho-chi-minh/124928328.htm,2025-11-28 15:50:25,18.0,8.754248,1,Giá CAO bất thường. AI dự đoán: 8.75 tr. (Cao hơn 106%)
1878,spark 135i 2016,109.000.000 đ,30.13 tr,35.37 tr,"Phường Tân Thới Nhất, Quận 12, Tp Hồ Chí Minh","spark 135i đẳng cấp dân chơi 
đầu nồi zin ... chưa đụng chạm
áo zin dán keo , 
máy móc như xe đạp điện . 
Giá để AE trãi nghiệm chơi chán bán không lỗ .",Yamaha,Dòng khác,2016,10000,Đã sử dụng,Xe số,100 - 175 cc,Nhật Bản,Bảo hành hãng,> 50 kg,https://xe.chotot.com/mua-ban-xe-may-quan-12-tp-ho-chi-minh/124836909.htm,2025-11-28 15:50:25,109.0,12.993441,1,Giá CAO bất thường. AI dự đoán: 12.99 tr. (Cao hơn 739%)
1879,Xe chính chủ,75.000.000 đ,69 tr,81 tr,"Phường Tân Hưng Thuận, Quận 12, Tp Hồ Chí Minh",Zin đẹp sạch sẽ..ngay chủ kí giấy tờ.. kèm theo 1 pô.1xilamh,Yamaha,Dòng khác,1995,99999,Đã sử dụng,Tay côn/Moto,50 - 100 cc,Ấn Độ,Bảo hành hãng,> 50 kg,https://xe.chotot.com/mua-ban-xe-may-quan-12-tp-ho-chi-minh/124843503.htm,2025-11-28 15:50:25,75.0,24.023897,1,Giá CAO bất thường. AI dự đoán: 24.02 tr. (Cao hơn 212%)
1883,do không đi đến cần bán lại yêu thich,70.000.000 đ,32.02 tr,37.58 tr,"Phường Tân Chánh Hiệp, Quận 12, Tp Hồ Chí Minh",Do nhu cầu không đi tới bán lại cho yêu thích xe đẹp chính chủ rút hồ sơ ai muốn sang tên cần liên hệ xem xe ***,Honda,CB,2005,200000,Đã sử dụng,Tay côn/Moto,Trên 175 cc,Nhật Bản,Bảo hành hãng,> 50 kg,https://xe.chotot.com/mua-ban-xe-may-quan-12-tp-ho-chi-minh/124781840.htm,2025-11-28 15:50:25,70.0,38.809254,1,Giá CAO bất thường. AI dự đoán: 38.81 tr. (Cao hơn 80%)
1892,xe cop zin nguyên bản,46.000.000 đ,13.94 tr,16.37 tr,"Phường Tân Chánh Hiệp, Quận 12, Tp Hồ Chí Minh",xe cop zin nguyên bản mình trùm mềm lâu lắm rồi nay cần tiền nên chia lại ae nào đam mê dòng này thi alo mình nhé.,Honda,Future,2001,18000,Đã sử dụng,Xe số,100 - 175 cc,Nhật Bản,Bảo hành hãng,> 50 kg,https://xe.chotot.com/mua-ban-xe-may-quan-12-tp-ho-chi-minh/124797027.htm,2025-11-28 15:50:25,46.0,15.80006,1,Giá CAO bất thường. AI dự đoán: 15.80 tr. (Cao hơn 191%)
1896,sh mode 2020 bản đặc biệt,860.000 đ,42.32 tr,49.68 tr,"Phường Hiệp Thành, Quận 12, Tp Hồ Chí Minh",dư ít phụ kiện zin vừa tháo xe thanh lý ae nào lấy có bớt lộcp,Honda,SH Mode,2020,100000,Đã sử dụng,Tay ga,100 - 175 cc,Việt Nam,Bảo hành hãng,> 50 kg,https://xe.chotot.com/mua-ban-xe-may-quan-12-tp-ho-chi-minh/124781523.htm,2025-11-28 15:50:25,0.86,18.2521,1,Giá RẺ bất thường. AI dự đoán: 18.25 tr. (Thấp hơn 95%)
1909,Bán xe Jupiter Mx zin,9.500.000 đ,6.78 tr,7.96 tr,"Phường An Phú Đông, Quận 12, Tp Hồ Chí Minh","Nhà dư không sử dụng đến cần bán E Jupiter MX đời 2008.
👉 Máy Zin theo xe siêu êm, siêu tiết kiệm nhiên liệu.
👉 Biển số Sài gòn.
💥 Giá bán :9.500.000đ
A/e ai có nhu cầu liên hệ Zl or Sđt *** để xem xe trực tiếp tại nhà nhé.",Yamaha,Jupiter,2008,17000,Đã sử dụng,Xe số,50 - 100 cc,Việt Nam,Bảo hành hãng,> 50 kg,https://xe.chotot.com/mua-ban-xe-may-quan-12-tp-ho-chi-minh/124702028.htm,2025-11-28 15:50:25,9.5,5.3889694,1,Giá CAO bất thường. AI dự đoán: 5.39 tr. (Cao hơn 76%)
1910,Dành cho xe tay ga,4.500.000 đ,38.54 tr,45.24 tr,"Phường Tân Thới Hiệp, Quận 12, Tp Hồ Chí Minh",Có tăng giảm dành cho xe tay ga Honda và yamaha đi nhanh 450 k,Honda,Lead,2024,900,Đã sử dụng,Tay ga,100 - 175 cc,Nhật Bản,Bảo hành hãng,> 50 kg,https://xe.chotot.com/mua-ban-xe-may-quan-12-tp-ho-chi-minh/124697787.htm,2025-11-28 15:50:25,4.5,25.298382,1,Giá RẺ bất thường. AI dự đoán: 25.30 tr. (Thấp hơn 82%)
1919,Cần bán gấp xe dream thái tem lửa 96,27.000.000 đ,14.49 tr,17.01 tr,"Phường Thới An, Quận 12, Tp Hồ Chí Minh",Xe chính chủ của người cao tuổi đi jờ sk già yếu k đi nổi nên chia sẽ với những a chị e nào có niềm đam mê về dòng xe này xe này đi gửi gin rất cẩn thận bảo dưỡng thường xuyên máy móc êm ru đồ đặt nguyên thủy còn theo xe nếu a chị e nào có thiệt trí muốn mua thì dt trực tiếp cho mình nhé,Honda,Dream,1996,51062,Đã sử dụng,Xe số,50 - 100 cc,Nhật Bản,Bảo hành hãng,> 50 kg,https://xe.chotot.com/mua-ban-xe-may-quan-12-tp-ho-chi-minh/124660070.htm,2025-11-28 15:50:25,27.0,15.217709,1,Giá CAO bất thường. AI dự đoán: 15.22 tr. (Cao hơn 77%)
1920,Cần bán gấp xe dream thái đời 96,32.500.000 đ,14.49 tr,17.01 tr,"Phường Thới An, Quận 12, Tp Hồ Chí Minh",Xe của ng cao tuổi đi jờ sức khỏe kém nên k đi dc xe nữa xe đi kỷ kiếm tra định kỳ thường xuyên máy móc đồ đạt còn zin theo xe a e nào có thiện trí muốn mua thì alo cho mình nhé trong giờ hành chính,Honda,Dream,1996,3245,Đã sử dụng,Xe số,50 - 100 cc,Đang cập nhật,Bảo hành hãng,> 50 kg,https://xe.chotot.com/mua-ban-xe-may-quan-12-tp-ho-chi-minh/124656438.htm,2025-11-28 15:50:25,32.5,13.723892,1,Giá CAO bất thường. AI dự đoán: 13.72 tr. (Cao hơn 137%)
1928,Bán Suzuki GZ150A đời 2013,38.500.000 đ,35.67 tr,41.87 tr,"Phường Tân Hưng Thuận, Quận 12, Tp Hồ Chí Minh","Suzuki GZ150A đời 2013, odo 26.619. Xe còn đẹp, do ít có thời gian chạy nên nhường lại cho anh em cùng đam mê. Xe mình bán, mình là chính chủ. Xe giấy tờ đầy đủ, đã làm cà vẹt mới. Xe mới làm thắng đĩa sau.",Suzuki,GZ,2013,26619,Đã sử dụng,Tay côn/Moto,100 - 175 cc,Đang cập nhật,Bảo hành hãng,> 50 kg,https://xe.chotot.com/mua-ban-xe-may-quan-12-tp-ho-chi-minh/124240037.htm,2025-11-28 15:50:25,38.5,20.99871,1,Giá CAO bất thường. AI dự đoán: 21.00 tr. (Cao hơn 83%)
1932,Côn Tay+Yamaha+Ex150+2015+Xanh dương+đã sử dụng,35.000.000 đ,16.16 tr,18.97 tr,"Phường Tân Chánh Hiệp, Quận 12, Tp Hồ Chí Minh","Ex150 đời 2015 màu xanh dương movista phản quang
Cấu hình: 65 dên zin, tay Uma, két nước lớn Uma, bình xăng lớn 7L
Full ốc salaya, lên vài món đồ chơi hiệu năng cho anh em trải nghiệm
Chính chủ BSTP 59S2-345.35
Xe bao đẹp, cho anh em có nhu cầu mua về chơi cùng đam mê. 
Giá: 3x.xxx.xxx ( fix thêm cho anh em thật sự cần)",Yamaha,Exciter,2015,27000,Đã sử dụng,Tay côn/Moto,100 - 175 cc,Đang cập nhật,Bảo hành hãng,> 50 kg,https://xe.chotot.com/mua-ban-xe-may-quan-12-tp-ho-chi-minh/124616255.htm,2025-11-28 15:50:25,35.0,15.353188,1,Giá CAO bất thường. AI dự đoán: 15.35 tr. (Cao hơn 128%)
1941,satria 2019,22.000.000 đ,19.92 tr,23.38 tr,"Phường Tân Thới Hiệp, Quận 12, Tp Hồ Chí Minh",Satria zin 2019 BSTP. Mâm zin còn. Máy móc zin. Chính chủ,Suzuki,Satria,2019,32000,Đã sử dụng,Xe số,100 - 175 cc,Nước khác,Bảo hành hãng,> 50 kg,https://xe.chotot.com/mua-ban-xe-may-quan-12-tp-ho-chi-minh/124566528.htm,2025-11-28 15:50:25,22.0,12.03843,1,Giá CAO bất thường. AI dự đoán: 12.04 tr. (Cao hơn 83%)
1964,cần bán xe tay ga 50cc 9c,10.800.000 đ,8.72 tr,10.23 tr,"Phường Trung Mỹ Tây, Quận 12, Tp Hồ Chí Minh","Xe tay ga 50cc có ủy quyền xe
Tình trạng xe đi mỗi ngày máy êm thay nhớt máy và nhớt láp định kỳ,do con cái đã lớn nên không sử dụng nữa cần bán có thương lượng hoặc trao đổi giao lưu xe
Biển TPHCM 5 số
Ae có nhu cầu ib còn tin còn xe.",Kymco,Candy Hi,2009,10000,Đã sử dụng,Tay ga,Dưới 50 cc,Đài Loan,Bảo hành hãng,> 50 kg,https://xe.chotot.com/mua-ban-xe-may-quan-12-tp-ho-chi-minh/124412095.htm,2025-11-28 15:50:25,10.8,5.4712214,1,Giá CAO bất thường. AI dự đoán: 5.47 tr. (Cao hơn 97%)
1968,Bán Cup custom 92 _50cc,20.000.000 đ,5.26 tr,6.18 tr,"Phường Tân Hưng Thuận, Quận 12, Tp Hồ Chí Minh",Cần bán Cup custom 92 _50cc . Xe đẹp cho hoc sinh không bằng lái xe,Honda,Cub,2000,20000,Đã sử dụng,Xe số,Dưới 50 cc,Nhật Bản,Bảo hành hãng,> 50 kg,https://xe.chotot.com/mua-ban-xe-may-quan-12-tp-ho-chi-minh/124385401.htm,2025-11-28 15:50:25,20.0,9.166609,1,Giá CAO bất thường. AI dự đoán: 9.17 tr. (Cao hơn 118%)
1972,can ban cup 81 kim vang giot le,19.000.000 đ,6.61 tr,7.76 tr,"Phường Tân Thới Nhất, Quận 12, Tp Hồ Chí Minh","Honda cub 81
Giấy tờ đầy đủ, bstp
zin nguyên con
Full chức năng 
bán lại cho ace đam mê
xe chùm mền ít đi làm kiển
đi cà phê thôi
Tin còn là xe còn
xem ky hinh nha cac A/C hang hiem do",Honda,Cub,1981,19998,Đã sử dụng,Xe số,Dưới 50 cc,Nhật Bản,Bảo hành hãng,> 50 kg,https://xe.chotot.com/mua-ban-xe-may-quan-12-tp-ho-chi-minh/122571723.htm,2025-11-28 15:50:25,19.0,9.402509,1,Giá CAO bất thường. AI dự đoán: 9.40 tr. (Cao hơn 102%)
1978,Bán xe 67 rin,50.000.000 đ,12.07 tr,14.17 tr,"Phường Thạnh Lộc, Quận 12, Tp Hồ Chí Minh","Bán gấp chiếc 67 rin từ trong ra ngoài , máy rin số móc 5 số, biển số TP chính chủ công chứng ủy quyền hay sang tên đều được, máy móc êm ru ko có gì phải bàn, áo bao đẹp",Honda,67,trước năm 1980,3000,Đã sử dụng,Tay côn/Moto,50 - 100 cc,Nhật Bản,Bảo hành hãng,> 50 kg,https://xe.chotot.com/mua-ban-xe-may-quan-12-tp-ho-chi-minh/124279864.htm,2025-11-28 15:50:25,50.0,22.465715,1,Giá CAO bất thường. AI dự đoán: 22.47 tr. (Cao hơn 123%)
1990,Cần bán SH Ý đầu số 105,188.000.000 đ,11.13 tr,13.07 tr,"Phường An Phú Đông, Quận 12, Tp Hồ Chí Minh","Cần bán xe sh nhà đi đầu số 105 biển tú quý xe nữ đi cứng cáp chính chủ ít sử dụng nay cần bán giá 188tr 
Xe nhà sử dụng ko phải cửa hàng mua bán ai cần mua qua xem xe trực tiếp 
Liên hệ :",Hãng khác,Dòng khác,2023,999999,Đã sử dụng,Tay ga,100 - 175 cc,Đang cập nhật,Bảo hành hãng,> 50 kg,https://xe.chotot.com/mua-ban-xe-may-quan-12-tp-ho-chi-minh/124180110.htm,2025-11-28 15:50:25,188.0,41.451332,1,Giá CAO bất thường. AI dự đoán: 41.45 tr. (Cao hơn 354%)
2002,"Spacy nâu cổ điển, máy zin, giấy tờ chính chủ SG",50.000.000 đ,31.2 tr,36.62 tr,"Phường Tân Thới Nhất, Quận 12, Tp Hồ Chí Minh","Xe nhập Nhật
Ít đi, 36k km
Giấy tờ biển số SG, chính chủ",Honda,Spacy,2002,36600,Đã sử dụng,Tay ga,100 - 175 cc,Nhật Bản,Bảo hành hãng,> 50 kg,https://xe.chotot.com/mua-ban-xe-may-quan-12-tp-ho-chi-minh/124111702.htm,2025-11-28 15:50:25,50.0,23.075134,1,Giá CAO bất thường. AI dự đoán: 23.08 tr. (Cao hơn 117%)
2003,CẦN RA ĐI EM XIPO ĐỜI 1998,280.000.000 đ,118.87 tr,139.54 tr,"Phường Hiệp Thành, Quận 12, Tp Hồ Chí Minh","Con xe Suzuki sport xipo 120 HQCN

-Chất xe keng từng con ốc, full mới.

-Xe đẹp leng leng keng keng máy móc êm nhẹ, máy chạy cực mê.

Gía : 280.000.000 VND - Chính chủ bao sang tên 

Liên hệ : *** (A. LUÂN ) để xem xe nhé ae.",Suzuki,Sport / Xipo,1998,2000,Đã sử dụng,Tay côn/Moto,100 - 175 cc,Đang cập nhật,Bảo hành hãng,> 50 kg,https://xe.chotot.com/mua-ban-xe-may-quan-12-tp-ho-chi-minh/124105213.htm,2025-11-28 15:50:25,280.0,91.982216,1,Giá CAO bất thường. AI dự đoán: 91.98 tr. (Cao hơn 204%)
2025,"Bán Xe Honda Cub 82 đời 1993, Xe nhật bản",18.000.000 đ,11.95 tr,14.03 tr,"Phường Tân Chánh Hiệp, Quận 12, Tp Hồ Chí Minh","Bán Xe Honda Cub 82 máy 70cc đời 1993, Made in japan, mầu xe mầu đỏ đậm nguyên bản (dòng xe này chỉ 1 lần ra mầu này). Có kèm video xem thử nổ máy. Cà vẹt (đăng ký) chính chủ đầy đủ giấy tờ. Đến xem xe, test nổ máy thứ nếu ok thì mua. Giá bán 18 triệu. Thông tin liện hệ: - Địa chỉ: 31 Tổ 1, KP2, Tân Chánh Hiệp, Quận 12, Thành phố Hồ Chí Minh. Điện thoại: *** (ai có nhu cầu liên hệ Zalo nhắn tin sẽ trả lời)",Honda,Cub,1993,600000,Đã sử dụng,Xe số,50 - 100 cc,Nhật Bản,Bảo hành hãng,> 50 kg,https://xe.chotot.com/mua-ban-xe-may-quan-12-tp-ho-chi-minh/123981191.htm,2025-11-28 15:50:25,18.0,9.528707,1,Giá CAO bất thường. AI dự đoán: 9.53 tr. (Cao hơn 89%)
2027,"Cần ra đi em nó, xe đang mâm zin, máy zin,",23.000.000 đ,21.52 tr,25.26 tr,"Phường Hiệp Thành, Quận 12, Tp Hồ Chí Minh","Xe nguyên zin từ con ốc, đang mâm zin, ít chạy",Suzuki,Satria,2020,28000,Đã sử dụng,Xe số,100 - 175 cc,Đang cập nhật,Bảo hành hãng,> 50 kg,https://xe.chotot.com/mua-ban-xe-may-quan-12-tp-ho-chi-minh/123970745.htm,2025-11-28 15:50:25,23.0,13.056558,1,Giá CAO bất thường. AI dự đoán: 13.06 tr. (Cao hơn 76%)
2036,Xe winner v1 doi chủ,25.000.000 đ,13.38 tr,15.71 tr,"Phường Đông Hưng Thuận, Quận 12, Tp Hồ Chí Minh",Xe 1don chủ v1 năm 2017 tình trạng máy êm xe zin chưa thay thế bất cứ gì chi thay nhông sên dĩa,Honda,Winner,2017,45000,Đã sử dụng,Tay côn/Moto,100 - 175 cc,Việt Nam,Bảo hành hãng,> 50 kg,https://xe.chotot.com/mua-ban-xe-may-quan-12-tp-ho-chi-minh/123898725.htm,2025-11-28 15:50:25,25.0,14.024529,1,Giá CAO bất thường. AI dự đoán: 14.02 tr. (Cao hơn 78%)
2040,Ra đi SH150. Ý đập thùng. zin nguyên chiếc,222.222.222 đ,58.13 tr,68.25 tr,"Phường An Phú Đông, Quận 12, Tp Hồ Chí Minh","Hết nhu cầu sử dụng để lâu k chạy e ra đi con SH150 đầu 108 ( zin nguyên con chưa đụng chạm bất cứ thứ gì ) 
- odo chuẩn 
- DKLD 2018 ( chính chủ SG ) đồ zin còn đầy đủ
Giá thương lượng. xe ko gấp xin đừng ép giá",Honda,SH,2018,35900,Đã sử dụng,Tay ga,100 - 175 cc,Nước khác,Bảo hành hãng,> 50 kg,https://xe.chotot.com/mua-ban-xe-may-quan-12-tp-ho-chi-minh/123849184.htm,2025-11-28 15:50:25,222.222222,69.26284,1,Giá CAO bất thường. AI dự đoán: 69.26 tr. (Cao hơn 221%)
2044,"Wave Alpha lốc đen máy móc nguyên zin, bs cực Vip",31.000.000 đ,10.55 tr,12.38 tr,"Phường Trung Mỹ Tây, Quận 12, Tp Hồ Chí Minh","-> Nhường lại đam mê! Đã khoác lên áo như xe thùng hàng chính hãng Honda xé bịch... Bs Vip sảnh tiến (Phong Thủy, làm ăn thì rất Ok); đầu máy chưa mở ngoại trừ nắp chao; êm thì thầm. Giá mềm cho 1 siêu phẩm huyền thoại để cho anh em đam mê cafe dạo phố 🎆 a,e cần thật sự thì nt và đến trực tiếp. Hoặc có giao lưu tay ga ưu tiên SH Mode, PCX, Scoopy... Giao lưu hợp lý.Nhờ admin duyệt bài ✅",Honda,Wave,2002,3030,Đã sử dụng,Xe số,100 - 175 cc,Nhật Bản,Bảo hành hãng,> 50 kg,https://xe.chotot.com/mua-ban-xe-may-quan-12-tp-ho-chi-minh/122387599.htm,2025-11-28 15:50:25,31.0,16.74125,1,Giá CAO bất thường. AI dự đoán: 16.74 tr. (Cao hơn 85%)
2065,supper dream 54,58.500.000 đ,4.61 tr,5.41 tr,"Phường Tân Thới Nhất, Quận 12, Tp Hồ Chí Minh","Xe dọn mới 
Áo mới . Tem mới .
Phuộc nice zin vô chén
Máy 12/54 . Bình bông
Choá zinpat
Chi tiết đen nhún cacbon
Xe mình dọn từng chi tiết
Ae nhìn hình đánh giá . Bao công chứng . Có bớt cafe ah em nhanh gọn. Có giao lưu xe",Honda,Dream,2009,1000,Đã sử dụng,Xe số,100 - 175 cc,Việt Nam,Bảo hành hãng,> 50 kg,https://xe.chotot.com/mua-ban-xe-may-quan-12-tp-ho-chi-minh/123482611.htm,2025-11-28 15:50:25,58.5,10.237063,1,Giá CAO bất thường. AI dự đoán: 10.24 tr. (Cao hơn 471%)
2090,Xe bao đẹp,260.000.000 đ,22.36 tr,26.25 tr,"Phường Hiệp Thành, Quận 12, Tp Hồ Chí Minh",Xe nữ đi xe còn rất mới mẻ đẹp mua xe khác nên cần bán0k 000000000000,Yamaha,Exciter,2020,10542,Đã sử dụng,Xe số,100 - 175 cc,Việt Nam,Bảo hành hãng,> 50 kg,https://xe.chotot.com/mua-ban-xe-may-quan-12-tp-ho-chi-minh/123787117.htm,2025-11-28 15:50:25,260.0,25.418608,1,Giá CAO bất thường. AI dự đoán: 25.42 tr. (Cao hơn 923%)
2119,"SH ABS 150 2021. xe chính chủ, còn thương lượng.",82.000.000 đ,69.27 tr,81.32 tr,"Phường Thạnh Lộc, Quận 12, Tp Hồ Chí Minh",Xe nữ chạy nên máy còn im và xe được dán keo nguyên xe nên anh chị cứ yên tâm nha.,Honda,SH,2021,50000,Đã sử dụng,Tay ga,100 - 175 cc,Việt Nam,Bảo hành hãng,> 50 kg,https://xe.chotot.com/mua-ban-xe-may-quan-12-tp-ho-chi-minh/123736181.htm,2025-11-28 15:50:25,82.0,46.757076,1,Giá CAO bất thường. AI dự đoán: 46.76 tr. (Cao hơn 75%)
2143,Dream Thailand đời đầu 3 cục chất zin sưu tầm,30.000.000 đ,11.04 tr,12.96 tr,"Phường Trung Mỹ Tây, Quận 12, Tp Hồ Chí Minh","Phmotocare 13 tô ký trung mỹ tây quận 12
Chuyên mua bán trao đổi các dòng xe máy cũ giá *** thị trường đến tay người tiêu dùng

Dream thái chính chủ đời đầu 3 cục chất zin sưu tầm cho anh em đam mê thiện chí, ngoại hình xe tổng thể rất mới và đẹp, dàn nhựa dàn chân cứng cáp máy móc êm ái xe chính chủ của một đại gia quận 1 giữ kĩ chăm bảo dưỡng định kì còn rất mới
Sang tên uỷ quyền mua bán đầy đủ 
Có fix chút cho người thiện chí giới thiệu, ai quan tâm ib zalo hoặc qua chotot cho cửa hàng nhé!",Honda,Dream,1992,500000,Đã sử dụng,Xe số,50 - 100 cc,Thái Lan,Bảo hành hãng,> 50 kg,https://xe.chotot.com/mua-ban-xe-may-quan-12-tp-ho-chi-minh/123711603.htm,2025-11-28 15:50:25,30.0,15.908207,1,Giá CAO bất thường. AI dự đoán: 15.91 tr. (Cao hơn 89%)
2201,bán xe,45.000.000 đ,11.25 tr,13.21 tr,"Phường Tân Thới Hiệp, Quận 12, Tp Hồ Chí Minh","Dream thái 
Dọn từ trong ra ngoài
Xe tâm huyết",Honda,Dream,2023,28000,Đã sử dụng,Xe số,50 - 100 cc,Thái Lan,Bảo hành hãng,> 50 kg,https://xe.chotot.com/mua-ban-xe-may-quan-12-tp-ho-chi-minh/123610207.htm,2025-11-28 15:50:25,45.0,25.45326,1,Giá CAO bất thường. AI dự đoán: 25.45 tr. (Cao hơn 77%)
2209,ab thái 2009,32.000.000 đ,8.6 tr,10.1 tr,"Phường Hiệp Thành, Quận 12, Tp Hồ Chí Minh",Cần bán xe an tết ab 2009 chính chủ xe zin máy êm,Honda,Air Blade,2009,20000,Đã sử dụng,Tay ga,100 - 175 cc,Thái Lan,Bảo hành hãng,> 50 kg,https://xe.chotot.com/mua-ban-xe-may-quan-12-tp-ho-chi-minh/122387157.htm,2025-11-28 15:50:25,32.0,16.932129,1,Giá CAO bất thường. AI dự đoán: 16.93 tr. (Cao hơn 89%)
2224,Cần bán xe,15.000.000 đ,5.51 tr,6.47 tr,"Phường Tân Thới Hiệp, Quận 12, Tp Hồ Chí Minh",Mình cần bán xe mio.loại nhỏ.xe bao zin máy móc zin hết.xe hok hú hí gì cả.minh cần bán 15tr xe biển số tứ quý 2222,Yamaha,Mio,2004,220000,Đã sử dụng,Tay ga,100 - 175 cc,Việt Nam,Bảo hành hãng,> 50 kg,https://xe.chotot.com/mua-ban-xe-may-quan-12-tp-ho-chi-minh/123403914.htm,2025-11-28 15:50:25,15.0,5.7274394,1,Giá CAO bất thường. AI dự đoán: 5.73 tr. (Cao hơn 162%)
2226,,,,,,"Xe đang trong tình trạng hoàn hảo không lỗi vặt gì hết. Nồi mới thay full đồ hãng đc 4 tháng, nhớt máy nhớt láp lọc gió mới thay anh chị em mua về chỉ sử dụng không cần sửa gì hết. Dàn áo cũ theo năm tháng nhưng k bể vỡ gì hết. Hình sao xe vậy em bán tại nhà anh chị em ưng thì qua thử xe. Cần tiền bán giá bèo nên lái tha em nha",Honda,Air Blade,2011,35000,Đã sử dụng,Tay ga,100 - 175 cc,Nhật Bản,Bảo hành hãng,> 50 kg,https://xe.chotot.com/mua-ban-xe-may-quan-12-tp-ho-chi-minh/123569402.htm,2025-11-28 15:50:25,0.0,7.849762,1,Giá nhập vào không hợp lệ
